trial	run_id	commit	status	stop_reason	objective_metric	objective_value	best_value	criteria_hit	hit_metric	sharpe	sortino	cagr	max_drawdown	win_rate	signal_rows	featured_rows	predictor_count	wall_seconds	idea_family	changed_files	artifact_dir	description
7	007_rank_score_max_positions_4	5d41830	discard	continue	sharpe	1.371249701227348	1.4502032808497105	false	max_drawdown	1.371249701227348	1.4352077419495795	0.2553072686065929	0.23216987166293895	0.33158396946564883				10.555688449181616	change_portfolio_params	configs/strategies/ml_factor/autoresearch/v1_ledger/next_steps.md;configs/strategies/ml_factor/autoresearch/v1_runs/ml_factor_classifier_v1/003_baseline_relative_config/command.json;configs/strategies/ml_factor/autoresearch/v1_runs/ml_factor_classifier_v1/003_baseline_relative_config/dataset_summary.csv;configs/strategies/ml_factor/autoresearch/v1_runs/ml_factor_classifier_v1/003_baseline_relative_config/effective_config.yaml;configs/strategies/ml_factor/autoresearch/v1_runs/ml_factor_classifier_v1/003_baseline_relative_config/manifest.json;configs/strategies/ml_factor/autoresearch/v1_runs/ml_factor_classifier_v1/003_baseline_relative_config/metrics.json;configs/strategies/ml_factor/autoresearch/v1_runs/ml_factor_classifier_v1/003_baseline_relative_config/model_frame.csv;configs/strategies/ml_factor/autoresearch/v1_runs/ml_factor_classifier_v1/003_baseline_relative_config/orders.csv;configs/strategies/ml_factor/autoresearch/v1_runs/ml_factor_classifier_v1/003_baseline_relative_config/orders_realized.csv;configs/strategies/ml_factor/autoresearch/v1_runs/ml_factor_classifier_v1/003_baseline_relative_config/orders_summary.csv;configs/strategies/ml_factor/autoresearch/v1_runs/ml_factor_classifier_v1/003_baseline_relative_config/params.csv;configs/strategies/ml_factor/autoresearch/v1_runs/ml_factor_classifier_v1/003_baseline_relative_config/portfolio.csv;configs/strategies/ml_factor/autoresearch/v1_runs/ml_factor_classifier_v1/003_baseline_relative_config/portfolio_stats.csv;configs/strategies/ml_factor/autoresearch/v1_runs/ml_factor_classifier_v1/003_baseline_relative_config/predictions.csv;configs/strategies/ml_factor/autoresearch/v1_runs/ml_factor_classifier_v1/003_baseline_relative_config/pyfolio_aligned_returns.csv;configs/strategies/ml_factor/autoresearch/v1_runs/ml_factor_classifier_v1/003_baseline_relative_config/pyfolio_stats.csv;configs/strategies/ml_factor/autoresearch/v1_runs/ml_factor_classifier_v1/003_baseline_relative_config/qts_metrics.csv;configs/strategies/ml_factor/autoresearch/v1_runs/ml_factor_classifier_v1/003_baseline_relative_config/run.log;configs/strategies/ml_factor/autoresearch/v1_runs/ml_factor_classifier_v1/003_baseline_relative_config/run_eval.csv;configs/strategies/ml_factor/autoresearch/v1_runs/ml_factor_classifier_v1/003_baseline_relative_config/selected_predictions.csv;configs/strategies/ml_factor/autoresearch/v1_runs/ml_factor_classifier_v1/003_baseline_relative_config/selected_realized_results.csv;configs/strategies/ml_factor/autoresearch/v1_runs/ml_factor_classifier_v1/003_baseline_relative_config/target_weights.csv;configs/strategies/ml_factor/autoresearch/v1_runs/ml_factor_classifier_v1/003_baseline_relative_config/trial_config.yaml;configs/strategies/ml_factor/autoresearch/v1_runs/ml_factor_classifier_v1/003_baseline_relative_config/trial_summary.md;configs/strategies/ml_factor/autoresearch/v1_runs/ml_factor_classifier_v1/003_baseline_relative_config/vectorbt_orders.csv;configs/strategies/ml_factor/autoresearch/v1_runs/ml_factor_classifier_v1/004_rank_score/command.json;configs/strategies/ml_factor/autoresearch/v1_runs/ml_factor_classifier_v1/004_rank_score/dataset_summary.csv;configs/strategies/ml_factor/autoresearch/v1_runs/ml_factor_classifier_v1/004_rank_score/effective_config.yaml;configs/strategies/ml_factor/autoresearch/v1_runs/ml_factor_classifier_v1/004_rank_score/manifest.json;configs/strategies/ml_factor/autoresearch/v1_runs/ml_factor_classifier_v1/004_rank_score/metrics.json;configs/strategies/ml_factor/autoresearch/v1_runs/ml_factor_classifier_v1/004_rank_score/model_frame.csv;configs/strategies/ml_factor/autoresearch/v1_runs/ml_factor_classifier_v1/004_rank_score/orders.csv;configs/strategies/ml_factor/autoresearch/v1_runs/ml_factor_classifier_v1/004_rank_score/orders_realized.csv;configs/strategies/ml_factor/autoresearch/v1_runs/ml_factor_classifier_v1/004_rank_score/orders_summary.csv;configs/strategies/ml_factor/autoresearch/v1_runs/ml_factor_classifier_v1/004_rank_score/params.csv;configs/strategies/ml_factor/autoresearch/v1_runs/ml_factor_classifier_v1/004_rank_score/portfolio.csv;configs/strategies/ml_factor/autoresearch/v1_runs/ml_factor_classifier_v1/004_rank_score/portfolio_stats.csv;configs/strategies/ml_factor/autoresearch/v1_runs/ml_factor_classifier_v1/004_rank_score/predictions.csv;configs/strategies/ml_factor/autoresearch/v1_runs/ml_factor_classifier_v1/004_rank_score/pyfolio_aligned_returns.csv;configs/strategies/ml_factor/autoresearch/v1_runs/ml_factor_classifier_v1/004_rank_score/pyfolio_stats.csv;configs/strategies/ml_factor/autoresearch/v1_runs/ml_factor_classifier_v1/004_rank_score/qts_metrics.csv;configs/strategies/ml_factor/autoresearch/v1_runs/ml_factor_classifier_v1/004_rank_score/run.log;configs/strategies/ml_factor/autoresearch/v1_runs/ml_factor_classifier_v1/004_rank_score/run_eval.csv;configs/strategies/ml_factor/autoresearch/v1_runs/ml_factor_classifier_v1/004_rank_score/selected_predictions.csv;configs/strategies/ml_factor/autoresearch/v1_runs/ml_factor_classifier_v1/004_rank_score/selected_realized_results.csv;configs/strategies/ml_factor/autoresearch/v1_runs/ml_factor_classifier_v1/004_rank_score/target_weights.csv;configs/strategies/ml_factor/autoresearch/v1_runs/ml_factor_classifier_v1/004_rank_score/trial_config.yaml;configs/strategies/ml_factor/autoresearch/v1_runs/ml_factor_classifier_v1/004_rank_score/trial_summary.md;configs/strategies/ml_factor/autoresearch/v1_runs/ml_factor_classifier_v1/004_rank_score/vectorbt_orders.csv;configs/strategies/ml_factor/autoresearch/v1_runs/ml_factor_classifier_v1/005_rank_score_max_positions_6/command.json;configs/strategies/ml_factor/autoresearch/v1_runs/ml_factor_classifier_v1/005_rank_score_max_positions_6/dataset_summary.csv;configs/strategies/ml_factor/autoresearch/v1_runs/ml_factor_classifier_v1/005_rank_score_max_positions_6/effective_config.yaml;configs/strategies/ml_factor/autoresearch/v1_runs/ml_factor_classifier_v1/005_rank_score_max_positions_6/manifest.json;configs/strategies/ml_factor/autoresearch/v1_runs/ml_factor_classifier_v1/005_rank_score_max_positions_6/metrics.json;configs/strategies/ml_factor/autoresearch/v1_runs/ml_factor_classifier_v1/005_rank_score_max_positions_6/model_frame.csv;configs/strategies/ml_factor/autoresearch/v1_runs/ml_factor_classifier_v1/005_rank_score_max_positions_6/orders.csv;configs/strategies/ml_factor/autoresearch/v1_runs/ml_factor_classifier_v1/005_rank_score_max_positions_6/orders_realized.csv;configs/strategies/ml_factor/autoresearch/v1_runs/ml_factor_classifier_v1/005_rank_score_max_positions_6/orders_summary.csv;configs/strategies/ml_factor/autoresearch/v1_runs/ml_factor_classifier_v1/005_rank_score_max_positions_6/params.csv;configs/strategies/ml_factor/autoresearch/v1_runs/ml_factor_classifier_v1/005_rank_score_max_positions_6/portfolio.csv;configs/strategies/ml_factor/autoresearch/v1_runs/ml_factor_classifier_v1/005_rank_score_max_positions_6/portfolio_stats.csv;configs/strategies/ml_factor/autoresearch/v1_runs/ml_factor_classifier_v1/005_rank_score_max_positions_6/predictions.csv;configs/strategies/ml_factor/autoresearch/v1_runs/ml_factor_classifier_v1/005_rank_score_max_positions_6/pyfolio_aligned_returns.csv;configs/strategies/ml_factor/autoresearch/v1_runs/ml_factor_classifier_v1/005_rank_score_max_positions_6/pyfolio_stats.csv;configs/strategies/ml_factor/autoresearch/v1_runs/ml_factor_classifier_v1/005_rank_score_max_positions_6/qts_metrics.csv;configs/strategies/ml_factor/autoresearch/v1_runs/ml_factor_classifier_v1/005_rank_score_max_positions_6/run.log;configs/strategies/ml_factor/autoresearch/v1_runs/ml_factor_classifier_v1/005_rank_score_max_positions_6/run_eval.csv;configs/strategies/ml_factor/autoresearch/v1_runs/ml_factor_classifier_v1/005_rank_score_max_positions_6/selected_predictions.csv;configs/strategies/ml_factor/autoresearch/v1_runs/ml_factor_classifier_v1/005_rank_score_max_positions_6/selected_realized_results.csv;configs/strategies/ml_factor/autoresearch/v1_runs/ml_factor_classifier_v1/005_rank_score_max_positions_6/target_weights.csv;configs/strategies/ml_factor/autoresearch/v1_runs/ml_factor_classifier_v1/005_rank_score_max_positions_6/trial_config.yaml;configs/strategies/ml_factor/autoresearch/v1_runs/ml_factor_classifier_v1/005_rank_score_max_positions_6/trial_summary.md;configs/strategies/ml_factor/autoresearch/v1_runs/ml_factor_classifier_v1/005_rank_score_max_positions_6/vectorbt_orders.csv;configs/strategies/ml_factor/autoresearch/v1_runs/ml_factor_classifier_v1/006_rank_score_max_positions_3/command.json;configs/strategies/ml_factor/autoresearch/v1_runs/ml_factor_classifier_v1/006_rank_score_max_positions_3/dataset_summary.csv;configs/strategies/ml_factor/autoresearch/v1_runs/ml_factor_classifier_v1/006_rank_score_max_positions_3/effective_config.yaml;configs/strategies/ml_factor/autoresearch/v1_runs/ml_factor_classifier_v1/006_rank_score_max_positions_3/manifest.json;configs/strategies/ml_factor/autoresearch/v1_runs/ml_factor_classifier_v1/006_rank_score_max_positions_3/metrics.json;configs/strategies/ml_factor/autoresearch/v1_runs/ml_factor_classifier_v1/006_rank_score_max_positions_3/model_frame.csv;configs/strategies/ml_factor/autoresearch/v1_runs/ml_factor_classifier_v1/006_rank_score_max_positions_3/orders.csv;configs/strategies/ml_factor/autoresearch/v1_runs/ml_factor_classifier_v1/006_rank_score_max_positions_3/orders_realized.csv;configs/strategies/ml_factor/autoresearch/v1_runs/ml_factor_classifier_v1/006_rank_score_max_positions_3/orders_summary.csv;configs/strategies/ml_factor/autoresearch/v1_runs/ml_factor_classifier_v1/006_rank_score_max_positions_3/params.csv;configs/strategies/ml_factor/autoresearch/v1_runs/ml_factor_classifier_v1/006_rank_score_max_positions_3/portfolio.csv;configs/strategies/ml_factor/autoresearch/v1_runs/ml_factor_classifier_v1/006_rank_score_max_positions_3/portfolio_stats.csv;configs/strategies/ml_factor/autoresearch/v1_runs/ml_factor_classifier_v1/006_rank_score_max_positions_3/predictions.csv;configs/strategies/ml_factor/autoresearch/v1_runs/ml_factor_classifier_v1/006_rank_score_max_positions_3/pyfolio_aligned_returns.csv;configs/strategies/ml_factor/autoresearch/v1_runs/ml_factor_classifier_v1/006_rank_score_max_positions_3/pyfolio_stats.csv;configs/strategies/ml_factor/autoresearch/v1_runs/ml_factor_classifier_v1/006_rank_score_max_positions_3/qts_metrics.csv;configs/strategies/ml_factor/autoresearch/v1_runs/ml_factor_classifier_v1/006_rank_score_max_positions_3/run.log;configs/strategies/ml_factor/autoresearch/v1_runs/ml_factor_classifier_v1/006_rank_score_max_positions_3/run_eval.csv;configs/strategies/ml_factor/autoresearch/v1_runs/ml_factor_classifier_v1/006_rank_score_max_positions_3/selected_predictions.csv;configs/strategies/ml_factor/autoresearch/v1_runs/ml_factor_classifier_v1/006_rank_score_max_positions_3/selected_realized_results.csv;configs/strategies/ml_factor/autoresearch/v1_runs/ml_factor_classifier_v1/006_rank_score_max_positions_3/target_weights.csv;configs/strategies/ml_factor/autoresearch/v1_runs/ml_factor_classifier_v1/006_rank_score_max_positions_3/trial_config.yaml;configs/strategies/ml_factor/autoresearch/v1_runs/ml_factor_classifier_v1/006_rank_score_max_positions_3/trial_summary.md;configs/strategies/ml_factor/autoresearch/v1_runs/ml_factor_classifier_v1/006_rank_score_max_positions_3/vectorbt_orders.csv;configs/strategies/ml_factor/autoresearch/v1_runs/ml_factor_classifier_v1/007_rank_score_max_positions_4/command.json;configs/strategies/ml_factor/autoresearch/v1_runs/ml_factor_classifier_v1/007_rank_score_max_positions_4/dataset_summary.csv;configs/strategies/ml_factor/autoresearch/v1_runs/ml_factor_classifier_v1/007_rank_score_max_positions_4/effective_config.yaml;configs/strategies/ml_factor/autoresearch/v1_runs/ml_factor_classifier_v1/007_rank_score_max_positions_4/manifest.json;configs/strategies/ml_factor/autoresearch/v1_runs/ml_factor_classifier_v1/007_rank_score_max_positions_4/metrics.json;configs/strategies/ml_factor/autoresearch/v1_runs/ml_factor_classifier_v1/007_rank_score_max_positions_4/model_frame.csv;configs/strategies/ml_factor/autoresearch/v1_runs/ml_factor_classifier_v1/007_rank_score_max_positions_4/orders.csv;configs/strategies/ml_factor/autoresearch/v1_runs/ml_factor_classifier_v1/007_rank_score_max_positions_4/orders_realized.csv;configs/strategies/ml_factor/autoresearch/v1_runs/ml_factor_classifier_v1/007_rank_score_max_positions_4/orders_summary.csv;configs/strategies/ml_factor/autoresearch/v1_runs/ml_factor_classifier_v1/007_rank_score_max_positions_4/params.csv;configs/strategies/ml_factor/autoresearch/v1_runs/ml_factor_classifier_v1/007_rank_score_max_positions_4/portfolio.csv;configs/strategies/ml_factor/autoresearch/v1_runs/ml_factor_classifier_v1/007_rank_score_max_positions_4/portfolio_stats.csv;configs/strategies/ml_factor/autoresearch/v1_runs/ml_factor_classifier_v1/007_rank_score_max_positions_4/predictions.csv;configs/strategies/ml_factor/autoresearch/v1_runs/ml_factor_classifier_v1/007_rank_score_max_positions_4/pyfolio_aligned_returns.csv;configs/strategies/ml_factor/autoresearch/v1_runs/ml_factor_classifier_v1/007_rank_score_max_positions_4/pyfolio_stats.csv;configs/strategies/ml_factor/autoresearch/v1_runs/ml_factor_classifier_v1/007_rank_score_max_positions_4/qts_metrics.csv;configs/strategies/ml_factor/autoresearch/v1_runs/ml_factor_classifier_v1/007_rank_score_max_positions_4/run.log;configs/strategies/ml_factor/autoresearch/v1_runs/ml_factor_classifier_v1/007_rank_score_max_positions_4/run_eval.csv;configs/strategies/ml_factor/autoresearch/v1_runs/ml_factor_classifier_v1/007_rank_score_max_positions_4/selected_predictions.csv;configs/strategies/ml_factor/autoresearch/v1_runs/ml_factor_classifier_v1/007_rank_score_max_positions_4/selected_realized_results.csv;configs/strategies/ml_factor/autoresearch/v1_runs/ml_factor_classifier_v1/007_rank_score_max_positions_4/target_weights.csv;configs/strategies/ml_factor/autoresearch/v1_runs/ml_factor_classifier_v1/007_rank_score_max_positions_4/trial_config.yaml;configs/strategies/ml_factor/autoresearch/v1_runs/ml_factor_classifier_v1/007_rank_score_max_positions_4/trial_summary.md;configs/strategies/ml_factor/autoresearch/v1_runs/ml_factor_classifier_v1/007_rank_score_max_positions_4/vectorbt_orders.csv	configs/strategies/ml_factor/autoresearch/v1_runs/ml_factor_classifier_v1/007_rank_score_max_positions_4	rank_col=score max_positions=4
