trial	run_id	commit	status	stop_reason	objective_metric	objective_value	best_value	criteria_hit	hit_metric	sharpe	sortino	cagr	max_drawdown	win_rate	signal_rows	featured_rows	predictor_count	wall_seconds	idea_family	changed_files	artifact_dir	description
86	086_threshold50_seed042_fallback3_max3_sl20	5d41830	discard	continue	sharpe	1.7120716675604024	1.8280890880755754	false		1.7120716675604024	1.93350213090901	0.509842282820673	0.28842767659688284	0.5734126984126984				15.408627989701927	stop_take_profit_rule	configs/strategies/ml_factor/autoresearch/__pycache__/run_classifier_trial.cpython-313.pyc;configs/strategies/ml_factor/autoresearch/run_classifier_trial.py;configs/strategies/ml_factor/autoresearch/v1_ledger/next_steps.md;configs/strategies/ml_factor/autoresearch/v1_ledger/results.pre_compact_20260629_ledger_fieldlimit.tsv;configs/strategies/ml_factor/autoresearch/v1_runs/ml_factor_classifier_v1/003_baseline_relative_config/command.json;configs/strategies/ml_factor/autoresearch/v1_runs/ml_factor_classifier_v1/003_baseline_relative_config/dataset_summary.csv;configs/strategies/ml_factor/autoresearch/v1_runs/ml_factor_classifier_v1/003_baseline_relative_config/effective_config.yaml;configs/strategies/ml_factor/autoresearch/v1_runs/ml_factor_classifier_v1/003_baseline_relative_config/manifest.json;configs/strategies/ml_factor/autoresearch/v1_runs/ml_factor_classifier_v1/003_baseline_relative_config/metrics.json;configs/strategies/ml_factor/autoresearch/v1_runs/ml_factor_classifier_v1/003_baseline_relative_config/model_frame.csv;configs/strategies/ml_factor/autoresearch/v1_runs/ml_factor_classifier_v1/003_baseline_relative_config/orders.csv;configs/strategies/ml_factor/autoresearch/v1_runs/ml_factor_classifier_v1/003_baseline_relative_config/orders_realized.csv;configs/strategies/ml_factor/autoresearch/v1_runs/ml_factor_classifier_v1/003_baseline_relative_config/orders_summary.csv;configs/strategies/ml_factor/autoresearch/v1_runs/ml_factor_classifier_v1/003_baseline_relative_config/params.csv;configs/strategies/ml_factor/autoresearch/v1_runs/ml_factor_classifier_v1/003_baseline_relative_config/portfolio.csv;configs/strategies/ml_factor/autoresearch/v1_runs/ml_factor_classifier_v1/003_baseline_relative_config/portfolio_stats.csv;configs/strategies/ml_factor/autoresearch/v1_runs/ml_factor_classifier_v1/003_baseline_relative_config/predictions.csv;configs/strategies/ml_factor/autoresearch/v1_runs/ml_factor_classifier_v1/003_baseline_relative_config/pyfolio_aligned_returns.csv;configs/strategies/ml_factor/autoresearch/v1_runs/ml_factor_classifier_v1/003_baseline_relative_config/pyfolio_stats.csv;configs/strategies/ml_factor/autoresearch/v1_runs/ml_factor_classifier_v1/003_baseline_relative_config/qts_metrics.csv;configs/strategies/ml_factor/autoresearch/v1_runs/ml_factor_classifier_v1/003_baseline_relative_config/run.log;configs/strategies/ml_factor/autoresearch/v1_runs/ml_factor_classifier_v1/003_baseline_relative_config/run_eval.csv;configs/strategies/ml_factor/autoresearch/v1_runs/ml_factor_classifier_v1/003_baseline_relative_config/selected_predictions.csv;configs/strategies/ml_factor/autoresearch/v1_runs/ml_factor_classifier_v1/003_baseline_relative_config/selected_realized_results.csv;configs/strategies/ml_factor/autoresearch/v1_runs/ml_factor_classifier_v1/003_baseline_relative_config/target_weights.csv;configs/strategies/ml_factor/autoresearch/v1_runs/ml_factor_classifier_v1/003_baseline_relative_config/trial_config.yaml;configs/strategies/ml_factor/autoresearch/v1_runs/ml_factor_classifier_v1/003_baseline_relative_config/trial_summary.md;configs/strategies/ml_factor/autoresearch/v1_runs/ml_factor_classifier_v1/003_baseline_relative_config/vectorbt_orders.csv;configs/strategies/ml_factor/autoresearch/v1_runs/ml_factor_classifier_v1/004_rank_score/command.json;configs/strategies/ml_factor/autoresearch/v1_runs/ml_factor_classifier_v1/004_rank_score/dataset_summary.csv;configs/strategies/ml_factor/autoresearch/v1_runs/ml_factor_classifier_v1/004_rank_score/effective_config.yaml;configs/strategies/ml_factor/autoresearch/v1_runs/ml_factor_classifier_v1/004_rank_score/manifest.json;configs/strategies/ml_factor/autoresearch/v1_runs/ml_factor_classifier_v1/004_rank_score/metrics.json;configs/strategies/ml_factor/autoresearch/v1_runs/ml_factor_classifier_v1/004_rank_score/model_frame.csv;configs/strategies/ml_factor/autoresearch/v1_runs/ml_factor_classifier_v1/004_rank_score/orders.csv;configs/strategies/ml_factor/autoresearch/v1_runs/ml_factor_classifier_v1/004_rank_score/orders_realized.csv;configs/strategies/ml_factor/autoresearch/v1_runs/ml_factor_classifier_v1/004_rank_score/orders_summary.csv;configs/strategies/ml_factor/autoresearch/v1_runs/ml_factor_classifier_v1/004_rank_score/params.csv;configs/strategies/ml_factor/autoresearch/v1_runs/ml_factor_classifier_v1/004_rank_score/portfolio.csv;configs/strategies/ml_factor/autoresearch/v1_runs/ml_factor_classifier_v1/004_rank_score/portfolio_stats.csv;configs/strategies/ml_factor/autoresearch/v1_runs/ml_factor_classifier_v1/004_rank_score/predictions.csv;configs/strategies/ml_factor/autoresearch/v1_runs/ml_factor_classifier_v1/004_rank_score/pyfolio_aligned_returns.csv;configs/strategies/ml_factor/autoresearch/v1_runs/ml_factor_classifier_v1/004_rank_score/pyfolio_stats.csv;configs/strategies/ml_factor/autoresearch/v1_runs/ml_factor_classifier_v1/004_rank_score/qts_metrics.csv;configs/strategies/ml_factor/autoresearch/v1_runs/ml_factor_classifier_v1/004_rank_score/run.log;configs/strategies/ml_factor/autoresearch/v1_runs/ml_factor_classifier_v1/004_rank_score/run_eval.csv;configs/strategies/ml_factor/autoresearch/v1_runs/ml_factor_classifier_v1/004_rank_score/selected_predictions.csv;configs/strategies/ml_factor/autoresearch/v1_runs/ml_factor_classifier_v1/004_rank_score/selected_realized_results.csv;configs/strategies/ml_factor/autoresearch/v1_runs/ml_factor_classifier_v1/004_rank_score/target_weights.csv;configs/strategies/ml_factor/autoresearch/v1_runs/ml_factor_classifier_v1/004_rank_score/trial_config.yaml;configs/strategies/ml_factor/autoresearch/v1_runs/ml_factor_classifier_v1/004_rank_score/trial_summary.md;configs/strategies/ml_factor/autoresearch/v1_runs/ml_factor_classifier_v1/004_rank_score/vectorbt_orders.csv;configs/strategies/ml_factor/autoresearch/v1_runs/ml_factor_classifier_v1/005_rank_score_max_positions_6/command.json;configs/strategies/ml_factor/autoresearch/v1_runs/ml_factor_classifier_v1/005_rank_score_max_positions_6/dataset_summary.csv;configs/strategies/ml_factor/autoresearch/v1_runs/ml_factor_classifier_v1/005_rank_score_max_positions_6/effective_config.yaml;configs/strategies/ml_factor/autoresearch/v1_runs/ml_factor_classifier_v1/005_rank_score_max_positions_6/manifest.json;configs/strategies/ml_factor/autoresearch/v1_runs/ml_factor_classifier_v1/005_rank_score_max_positions_6/metrics.json;configs/strategies/ml_factor/autoresearch/v1_runs/ml_factor_classifier_v1/005_rank_score_max_positions_6/model_frame.csv;configs/strategies/ml_factor/autoresearch/v1_runs/ml_factor_classifier_v1/005_rank_score_max_positions_6/orders.csv;configs/strategies/ml_factor/autoresearch/v1_runs/ml_factor_classifier_v1/005_rank_score_max_positions_6/orders_realized.csv;configs/strategies/ml_factor/autoresearch/v1_runs/ml_factor_classifier_v1/005_rank_score_max_positions_6/orders_summary.csv;configs/strategies/ml_factor/autoresearch/v1_runs/ml_factor_classifier_v1/005_rank_score_max_positions_6/params.csv;configs/strategies/ml_factor/autoresearch/v1_runs/ml_factor_classifier_v1/005_rank_score_max_positions_6/portfolio.csv;configs/strategies/ml_factor/autoresearch/v1_runs/ml_factor_classifier_v1/005_rank_score_max_positions_6/portfolio_stats.csv;configs/strategies/ml_factor/autoresearch/v1_runs/ml_factor_classifier_v1/005_rank_score_max_positions_6/predictions.csv;configs/strategies/ml_factor/autoresearch/v1_runs/ml_factor_classifier_v1/005_rank_score_max_positions_6/pyfolio_aligned_returns.csv;configs/strategies/ml_factor/autoresearch/v1_runs/ml_factor_classifier_v1/005_rank_score_max_positions_6/pyfolio_stats.csv;configs/strategies/ml_factor/autoresearch/v1_runs/ml_factor_classifier_v1/005_rank_score_max_positions_6/qts_metrics.csv;configs/strategies/ml_factor/autoresearch/v1_runs/ml_factor_classifier_v1/005_rank_score_max_positions_6/run.log;configs/strategies/ml_factor/autoresearch/v1_runs/ml_factor_classifier_v1/005_rank_score_max_positions_6/run_eval.csv;configs/strategies/ml_factor/autoresearch/v1_runs/ml_factor_classifier_v1/005_rank_score_max_positions_6/selected_predictions.csv;configs/strategies/ml_factor/autoresearch/v1_runs/ml_factor_classifier_v1/005_rank_score_max_positions_6/selected_realized_results.csv;configs/strategies/ml_factor/autoresearch/v1_runs/ml_factor_classifier_v1/005_rank_score_max_positions_6/target_weights.csv;configs/strategies/ml_factor/autoresearch/v1_runs/ml_factor_classifier_v1/005_rank_score_max_positions_6/trial_config.yaml;configs/strategies/ml_factor/autoresearch/v1_runs/ml_factor_classifier_v1/005_rank_score_max_positions_6/trial_summary.md;configs/strategies/ml_factor/autoresearch/v1_runs/ml_factor_classifier_v1/005_rank_score_max_positions_6/vectorbt_orders.csv;configs/strategies/ml_factor/autoresearch/v1_runs/ml_factor_classifier_v1/006_rank_score_max_positions_3/command.json;configs/strategies/ml_factor/autoresearch/v1_runs/ml_factor_classifier_v1/006_rank_score_max_positions_3/dataset_summary.csv;configs/strategies/ml_factor/autoresearch/v1_runs/ml_factor_classifier_v1/006_rank_score_max_positions_3/effective_config.yaml;configs/strategies/ml_factor/autoresearch/v1_runs/ml_factor_classifier_v1/006_rank_score_max_positions_3/manifest.json;configs/strategies/ml_factor/autoresearch/v1_runs/ml_factor_classifier_v1/006_rank_score_max_positions_3/metrics.json;configs/strategies/ml_factor/autoresearch/v1_runs/ml_factor_classifier_v1/006_rank_score_max_positions_3/model_frame.csv;configs/strategies/ml_factor/autoresearch/v1_runs/ml_factor_classifier_v1/006_rank_score_max_positions_3/orders.csv;configs/strategies/ml_factor/autoresearch/v1_runs/ml_factor_classifier_v1/006_rank_score_max_positions_3/orders_realized.csv;configs/strategies/ml_factor/autoresearch/v1_runs/ml_factor_classifier_v1/006_rank_score_max_positions_3/orders_summary.csv;configs/strategies/ml_factor/autoresearch/v1_runs/ml_factor_classifier_v1/006_rank_score_max_positions_3/params.csv;configs/strategies/ml_factor/autoresearch/v1_runs/ml_factor_classifier_v1/006_rank_score_max_positions_3/portfolio.csv;configs/strategies/ml_factor/autoresearch/v1_runs/ml_factor_classifier_v1/006_rank_score_max_positions_3/portfolio_stats.csv;configs/strategies/ml_factor/autoresearch/v1_runs/ml_factor_classifier_v1/006_rank_score_max_positions_3/predictions.csv;configs/strategies/ml_factor/autoresearch/v1_runs/ml_factor_classifier_v1/006_rank_score_max_positions_3/pyfolio_aligned_returns.csv;configs/strategies/ml_factor/autoresearch/v1_runs/ml_factor_classifier_v1/006_rank_score_max_positions_3/pyfolio_stats.csv;configs/strategies/ml_factor/autoresearch/v1_runs/ml_factor_classifier_v1/006_rank_score_max_positions_3/qts_metrics.csv;configs/strategies/ml_factor/autoresearch/v1_runs/ml_factor_classifier_v1/006_rank_score_max_positions_3/run.log;configs/strategies/ml_factor/autoresearch/v1_runs/ml_factor_classifier_v1/006_rank_score_max_positions_3/run_eval.csv;configs/strategies/ml_factor/autoresearch/v1_runs/ml_factor_classifier_v1/006_rank_score_max_positions_3/selected_predictions.csv;configs/strategies/ml_factor/autoresearch/v1_runs/ml_factor_classifier_v1/006_rank_score_max_positions_3/selected_realized_results.csv;configs/strategies/ml_factor/autoresearch/v1_runs/ml_factor_classifier_v1/006_rank_score_max_positions_3/target_weights.csv;configs/strategies/ml_factor/autoresearch/v1_runs/ml_factor_classifier_v1/006_rank_score_max_positions_3/trial_config.yaml;configs/strategies/ml_factor/autoresearch/v1_runs/ml_factor_classifier_v1/006_rank_score_max_positions_3/trial_summary.md;configs/strategies/ml_factor/autoresearch/v1_runs/ml_factor_classifier_v1/006_rank_score_max_positions_3/vectorbt_orders.csv;configs/strategies/ml_factor/autoresearch/v1_runs/ml_factor_classifier_v1/007_rank_score_max_positions_4/command.json;configs/strategies/ml_factor/autoresearch/v1_runs/ml_factor_classifier_v1/007_rank_score_max_positions_4/dataset_summary.csv;configs/strategies/ml_factor/autoresearch/v1_runs/ml_factor_classifier_v1/007_rank_score_max_positions_4/effective_config.yaml;configs/strategies/ml_factor/autoresearch/v1_runs/ml_factor_classifier_v1/007_rank_score_max_positions_4/manifest.json;configs/strategies/ml_factor/autoresearch/v1_runs/ml_factor_classifier_v1/007_rank_score_max_positions_4/metrics.json;configs/strategies/ml_factor/autoresearch/v1_runs/ml_factor_classifier_v1/007_rank_score_max_positions_4/model_frame.csv;configs/strategies/ml_factor/autoresearch/v1_runs/ml_factor_classifier_v1/007_rank_score_max_positions_4/orders.csv;configs/strategies/ml_factor/autoresearch/v1_runs/ml_factor_classifier_v1/007_rank_score_max_positions_4/orders_realized.csv;configs/strategies/ml_factor/autoresearch/v1_runs/ml_factor_classifier_v1/007_rank_score_max_positions_4/orders_summary.csv;configs/strategies/ml_factor/autoresearch/v1_runs/ml_factor_classifier_v1/007_rank_score_max_positions_4/params.csv;configs/strategies/ml_factor/autoresearch/v1_runs/ml_factor_classifier_v1/007_rank_score_max_positions_4/portfolio.csv;configs/strategies/ml_factor/autoresearch/v1_runs/ml_factor_classifier_v1/007_rank_score_max_positions_4/portfolio_stats.csv;configs/strategies/ml_factor/autoresearch/v1_runs/ml_factor_classifier_v1/007_rank_score_max_positions_4/predictions.csv;configs/strategies/ml_factor/autoresearch/v1_runs/ml_factor_classifier_v1/007_rank_score_max_positions_4/pyfolio_aligned_returns.csv;configs/strategies/ml_factor/autoresearch/v1_runs/ml_factor_classifier_v1/007_rank_score_max_positions_4/pyfolio_stats.csv;configs/strategies/ml_factor/autoresearch/v1_runs/ml_factor_classifier_v1/007_rank_score_max_positions_4/qts_metrics.csv;configs/strategies/ml_factor/autoresearch/v1_runs/ml_factor_classifier_v1/007_rank_score_max_positions_4/run.log;configs/strategies/ml_factor/autoresearch/v1_runs/ml_factor_classifier_v1/007_rank_score_max_positions_4/run_eval.csv;configs/strategies/ml_factor/autoresearch/v1_runs/ml_factor_classifier_v1/007_rank_score_max_positions_4/selected_predictions.csv;configs/strategies/ml_factor/autoresearch/v1_runs/ml_factor_classifier_v1/007_rank_score_max_positions_4/selected_realized_results.csv;configs/strategies/ml_factor/autoresearch/v1_runs/ml_factor_classifier_v1/007_rank_score_max_positions_4/target_weights.csv;configs/strategies/ml_factor/autoresearch/v1_runs/ml_factor_classifier_v1/007_rank_score_max_positions_4/trial_config.yaml;configs/strategies/ml_factor/autoresearch/v1_runs/ml_factor_classifier_v1/007_rank_score_max_positions_4/trial_summary.md;configs/strategies/ml_factor/autoresearch/v1_runs/ml_factor_classifier_v1/007_rank_score_max_positions_4/vectorbt_orders.csv;configs/strategies/ml_factor/autoresearch/v1_runs/ml_factor_classifier_v1/008_rank_score_rebalance_5/command.json;configs/strategies/ml_factor/autoresearch/v1_runs/ml_factor_classifier_v1/008_rank_score_rebalance_5/dataset_summary.csv;configs/strategies/ml_factor/autoresearch/v1_runs/ml_factor_classifier_v1/008_rank_score_rebalance_5/effective_config.yaml;configs/strategies/ml_factor/autoresearch/v1_runs/ml_factor_classifier_v1/008_rank_score_rebalance_5/manifest.json;configs/strategies/ml_factor/autoresearch/v1_runs/ml_factor_classifier_v1/008_rank_score_rebalance_5/metrics.json;configs/strategies/ml_factor/autoresearch/v1_runs/ml_factor_classifier_v1/008_rank_score_rebalance_5/model_frame.csv;configs/strategies/ml_factor/autoresearch/v1_runs/ml_factor_classifier_v1/008_rank_score_rebalance_5/orders.csv;configs/strategies/ml_factor/autoresearch/v1_runs/ml_factor_classifier_v1/008_rank_score_rebalance_5/orders_realized.csv;configs/strategies/ml_factor/autoresearch/v1_runs/ml_factor_classifier_v1/008_rank_score_rebalance_5/orders_summary.csv;configs/strategies/ml_factor/autoresearch/v1_runs/ml_factor_classifier_v1/008_rank_score_rebalance_5/params.csv;configs/strategies/ml_factor/autoresearch/v1_runs/ml_factor_classifier_v1/008_rank_score_rebalance_5/portfolio.csv;configs/strategies/ml_factor/autoresearch/v1_runs/ml_factor_classifier_v1/008_rank_score_rebalance_5/portfolio_stats.csv;configs/strategies/ml_factor/autoresearch/v1_runs/ml_factor_classifier_v1/008_rank_score_rebalance_5/predictions.csv;configs/strategies/ml_factor/autoresearch/v1_runs/ml_factor_classifier_v1/008_rank_score_rebalance_5/pyfolio_aligned_returns.csv;configs/strategies/ml_factor/autoresearch/v1_runs/ml_factor_classifier_v1/008_rank_score_rebalance_5/pyfolio_stats.csv;configs/strategies/ml_factor/autoresearch/v1_runs/ml_factor_classifier_v1/008_rank_score_rebalance_5/qts_metrics.csv;configs/strategies/ml_factor/autoresearch/v1_runs/ml_factor_classifier_v1/008_rank_score_rebalance_5/run.log;configs/strategies/ml_factor/autoresearch/v1_runs/ml_factor_classifier_v1/008_rank_score_rebalance_5/run_eval.csv;configs/strategies/ml_factor/autoresearch/v1_runs/ml_factor_classifier_v1/008_rank_score_rebalance_5/selected_predictions.csv;configs/strategies/ml_factor/autoresearch/v1_runs/ml_factor_classifier_v1/008_rank_score_rebalance_5/selected_realized_results.csv;configs/strategies/ml_factor/autoresearch/v1_runs/ml_factor_classifier_v1/008_rank_score_rebalance_5/target_weights.csv;configs/strategies/ml_factor/autoresearch/v1_runs/ml_factor_classifier_v1/008_rank_score_rebalance_5/trial_config.yaml;configs/strategies/ml_factor/autoresearch/v1_runs/ml_factor_classifier_v1/008_rank_score_rebalance_5/trial_summary.md;configs/strategies/ml_factor/autoresearch/v1_runs/ml_factor_classifier_v1/008_rank_score_rebalance_5/vectorbt_orders.csv;configs/strategies/ml_factor/autoresearch/v1_runs/ml_factor_classifier_v1/009_rank_score_rebalance_10/command.json;configs/strategies/ml_factor/autoresearch/v1_runs/ml_factor_classifier_v1/009_rank_score_rebalance_10/dataset_summary.csv;configs/strategies/ml_factor/autoresearch/v1_runs/ml_factor_classifier_v1/009_rank_score_rebalance_10/effective_config.yaml;configs/strategies/ml_factor/autoresearch/v1_runs/ml_factor_classifier_v1/009_rank_score_rebalance_10/manifest.json;configs/strategies/ml_factor/autoresearch/v1_runs/ml_factor_classifier_v1/009_rank_score_rebalance_10/metrics.json;configs/strategies/ml_factor/autoresearch/v1_runs/ml_factor_classifier_v1/009_rank_score_rebalance_10/model_frame.csv;configs/strategies/ml_factor/autoresearch/v1_runs/ml_factor_classifier_v1/009_rank_score_rebalance_10/orders.csv;configs/strategies/ml_factor/autoresearch/v1_runs/ml_factor_classifier_v1/009_rank_score_rebalance_10/orders_realized.csv;configs/strategies/ml_factor/autoresearch/v1_runs/ml_factor_classifier_v1/009_rank_score_rebalance_10/orders_summary.csv;configs/strategies/ml_factor/autoresearch/v1_runs/ml_factor_classifier_v1/009_rank_score_rebalance_10/params.csv;configs/strategies/ml_factor/autoresearch/v1_runs/ml_factor_classifier_v1/009_rank_score_rebalance_10/portfolio.csv;configs/strategies/ml_factor/autoresearch/v1_runs/ml_factor_classifier_v1/009_rank_score_rebalance_10/portfolio_stats.csv;configs/strategies/ml_factor/autoresearch/v1_runs/ml_factor_classifier_v1/009_rank_score_rebalance_10/predictions.csv;configs/strategies/ml_factor/autoresearch/v1_runs/ml_factor_classifier_v1/009_rank_score_rebalance_10/pyfolio_aligned_returns.csv;configs/strategies/ml_factor/autoresearch/v1_runs/ml_factor_classifier_v1/009_rank_score_rebalance_10/pyfolio_stats.csv;configs/strategies/ml_factor/autoresearch/v1_runs/ml_factor_classifier_v1/009_rank_score_rebalance_10/qts_metrics.csv;configs/strategies/ml_factor/autoresearch/v1_runs/ml_factor_classifier_v1/009_rank_score_rebalance_10/run.log;configs/strategies/ml_factor/autoresearch/v1_runs/ml_factor_classifier_v1/009_rank_score_rebalance_10/run_eval.csv;configs/strategies/ml_factor/autoresearch/v1_runs/ml_factor_classifier_v1/009_rank_score_rebalance_10/selected_predictions.csv;configs/strategies/ml_factor/autoresearch/v1_runs/ml_factor_classifier_v1/009_rank_score_rebalance_10/selected_realized_results.csv;configs/strategies/ml_factor/autoresearch/v1_runs/ml_factor_classifier_v1/009_rank_score_rebalance_10/target_weights.csv;configs/strategies/ml_factor/autoresearch/v1_runs/ml_factor_classifier_v1/009_rank_score_rebalance_10/trial_config.yaml;configs/strategies/ml_factor/autoresearch/v1_runs/ml_factor_classifier_v1/009_rank_score_rebalance_10/trial_summary.md;configs/strategies/ml_factor/autoresearch/v1_runs/ml_factor_classifier_v1/009_rank_score_rebalance_10/vectorbt_orders.csv;configs/strategies/ml_factor/autoresearch/v1_runs/ml_factor_classifier_v1/010_rank_score_forward_10/command.json;configs/strategies/ml_factor/autoresearch/v1_runs/ml_factor_classifier_v1/010_rank_score_forward_10/dataset_summary.csv;configs/strategies/ml_factor/autoresearch/v1_runs/ml_factor_classifier_v1/010_rank_score_forward_10/effective_config.yaml;configs/strategies/ml_factor/autoresearch/v1_runs/ml_factor_classifier_v1/010_rank_score_forward_10/manifest.json;configs/strategies/ml_factor/autoresearch/v1_runs/ml_factor_classifier_v1/010_rank_score_forward_10/metrics.json;configs/strategies/ml_factor/autoresearch/v1_runs/ml_factor_classifier_v1/010_rank_score_forward_10/model_frame.csv;configs/strategies/ml_factor/autoresearch/v1_runs/ml_factor_classifier_v1/010_rank_score_forward_10/orders.csv;configs/strategies/ml_factor/autoresearch/v1_runs/ml_factor_classifier_v1/010_rank_score_forward_10/orders_realized.csv;configs/strategies/ml_factor/autoresearch/v1_runs/ml_factor_classifier_v1/010_rank_score_forward_10/orders_summary.csv;configs/strategies/ml_factor/autoresearch/v1_runs/ml_factor_classifier_v1/010_rank_score_forward_10/params.csv;configs/str