trial	run_id	commit	status	stop_reason	objective_metric	objective_value	best_value	criteria_hit	hit_metric	sharpe	sortino	cagr	max_drawdown	win_rate	signal_rows	featured_rows	predictor_count	wall_seconds	idea_family	changed_files	artifact_dir	description
57	057_threshold_38_rank_config_fallback5_max6_no_sl	5d41830	discard	continue	sharpe	1.361240349268988	1.8280890880755754	false		1.361240349268988	1.4417989546243164	0.3253943033377036	0.2851999932354028	0.36211832061068705				19.086415180005133	change_portfolio_params	[compacted 1249 paths; full backup: results.pre_compact_20260629_ledger_fieldlimit.tsv]	configs/strategies/ml_factor/autoresearch/v1_runs/ml_factor_classifier_v1/057_threshold_38_rank_config_fallback5_max6_no_sl	probability_threshold=0.38 rank-score config fallback_min_positions=5 max_positions=6 no SL/TP
58	058_threshold_38_rank_config_fallback6_max6_no_sl	5d41830	discard	continue	sharpe	1.2326762013665733	1.8280890880755754	false		1.2326762013665733	1.3241892516798177	0.30356745079866543	0.30630008050606267	0.3597328244274809				23.10014960868284	change_portfolio_params	[compacted 1273 paths; full backup: results.pre_compact_20260629_ledger_fieldlimit.tsv]	configs/strategies/ml_factor/autoresearch/v1_runs/ml_factor_classifier_v1/058_threshold_38_rank_config_fallback6_max6_no_sl	probability_threshold=0.38 rank-score config fallback_min_positions=6 max_positions=6 no SL/TP
59	059_threshold_38_fallback3_max6_xgb20_depth3	5d41830	discard	continue	sharpe	1.1734379229546552	1.8280890880755754	false		1.1734379229546552	1.2543569500358973	0.2513028002218656	0.2967511555766988	0.3583015267175573				21.593604390975088	tune_hyperparams	[compacted 1297 paths; full backup: results.pre_compact_20260629_ledger_fieldlimit.tsv]	configs/strategies/ml_factor/autoresearch/v1_runs/ml_factor_classifier_v1/059_threshold_38_fallback3_max6_xgb20_depth3	probability_threshold=0.38 fallback_min_positions=3 max_positions=6 xgb_n_estimators=20 max_depth=3
60	060_threshold_38_fallback3_max6_xgb10_depth3	5d41830	discard	continue	sharpe	1.6656360235922076	1.8280890880755754	false		1.6656360235922076	1.8546196070778564	0.339202412337664	0.31534575243071933	0.36354961832061067				19.743470101151615	tune_hyperparams	[compacted 1321 paths; full backup: results.pre_compact_20260629_ledger_fieldlimit.tsv]	configs/strategies/ml_factor/autoresearch/v1_runs/ml_factor_classifier_v1/060_threshold_38_fallback3_max6_xgb10_depth3	probability_threshold=0.38 fallback_min_positions=3 max_positions=6 xgb_n_estimators=10 max_depth=3
61	061_threshold_38_fallback3_max6_xgb10_depth2	5d41830	discard	continue	sharpe	1.0942252858513377	1.8280890880755754	false		1.0942252858513377	1.2553243413800657	0.1849415892467523	0.2966201275710198	0.3549618320610687				17.788533703889698	tune_hyperparams	[compacted 1345 paths; full backup: results.pre_compact_20260629_ledger_fieldlimit.tsv]	configs/strategies/ml_factor/autoresearch/v1_runs/ml_factor_classifier_v1/061_threshold_38_fallback3_max6_xgb10_depth2	probability_threshold=0.38 fallback_min_positions=3 max_positions=6 xgb_n_estimators=10 max_depth=2
62	062_threshold_38_fallback3_max6_train_threshold_scope	5d41830	discard	continue	sharpe	1.081785389932894	1.8280890880755754	false		1.081785389932894	1.1488018969418499	0.258863852068397	0.3174365394834643	0.3568702290076336				16.570033201016486	tune_hyperparams	[compacted 1369 paths; full backup: results.pre_compact_20260629_ledger_fieldlimit.tsv]	configs/strategies/ml_factor/autoresearch/v1_runs/ml_factor_classifier_v1/062_threshold_38_fallback3_max6_train_threshold_scope	probability_threshold=0.38 fallback_min_positions=3 max_positions=6 classification_threshold_scope=train
63	063_threshold_38_rank_probsum_fallback3_max6_no_sl	5d41830	discard	continue	sharpe	1.6915341611048065	1.8280890880755754	false	max_drawdown	1.6915341611048065	1.9384054387674543	0.31473515442564803	0.24603863518469887	0.3654580152671756				15.485853063873947	change_portfolio_params	[compacted 1393 paths; full backup: results.pre_compact_20260629_ledger_fieldlimit.tsv]	configs/strategies/ml_factor/autoresearch/v1_runs/ml_factor_classifier_v1/063_threshold_38_rank_probsum_fallback3_max6_no_sl	probability_threshold=0.38 rank_col=class_3_4_prob fallback_min_positions=3 max_positions=6 no SL/TP
64	064_threshold_38_rank_probsum_fallback3_max6_stop_loss15	5d41830	discard	continue	sharpe	1.6537462429090495	1.8280890880755754	false	max_drawdown	1.6537462429090495	1.8798258362004796	0.29696230252287137	0.22611142914998597	0.366412213740458				13.821295941714197	stop_take_profit_rule	[compacted 1417 paths; full backup: results.pre_compact_20260629_ledger_fieldlimit.tsv]	configs/strategies/ml_factor/autoresearch/v1_runs/ml_factor_classifier_v1/064_threshold_38_rank_probsum_fallback3_max6_stop_loss15	probability_threshold=0.38 rank_col=class_3_4_prob fallback_min_positions=3 max_positions=6 stop_loss=0.15
65	065_threshold_38_rank_probsum_fallback3_max6_take_profit30	5d41830	discard	continue	sharpe	1.4256011460455174	1.8280890880755754	false	max_drawdown	1.4256011460455174	1.6202029105170634	0.2164773365862085	0.24603863518469857	0.36020992366412213				17.07598577393219	stop_take_profit_rule	[compacted 1441 paths; full backup: results.pre_compact_20260629_ledger_fieldlimit.tsv]	configs/strategies/ml_factor/autoresearch/v1_runs/ml_factor_classifier_v1/065_threshold_38_rank_probsum_fallback3_max6_take_profit30	probability_threshold=0.38 rank_col=class_3_4_prob fallback_min_positions=3 max_positions=6 take_profit=0.30
66	066_threshold_38_rank_score_fallback3_max6_rebalance7	5d41830	discard	continue	sharpe	1.2282190435762788	1.8280890880755754	false		1.2282190435762788	1.3952856373345581	0.20908971676148513	0.2738282841962049	0.35782442748091603				17.857443684712052	tune_hyperparams	[compacted 1465 paths; full backup: results.pre_compact_20260629_ledger_fieldlimit.tsv]	configs/strategies/ml_factor/autoresearch/v1_runs/ml_factor_classifier_v1/066_threshold_38_rank_score_fallback3_max6_rebalance7	probability_threshold=0.38 rank_col=score fallback_min_positions=3 max_positions=6 rebalance_frequency=7
67	067_threshold_38_rank_score_fallback3_max4_no_sl	5d41830	discard	continue	sharpe	1.585563937510527	1.8280890880755754	false		1.585563937510527	1.7966452797562487	0.4004306020820705	0.32503461484811924	0.36450381679389315				13.465313990134746	change_portfolio_params	[compacted 1489 paths; full backup: results.pre_compact_20260629_ledger_fieldlimit.tsv]	configs/strategies/ml_factor/autoresearch/v1_runs/ml_factor_classifier_v1/067_threshold_38_rank_score_fallback3_max4_no_sl	probability_threshold=0.38 rank_col=score fallback_min_positions=3 max_positions=4 no SL/TP
68	068_threshold_38_rank_score_fallback3_max8_no_sl	5d41830	discard	continue	sharpe	1.6892583181588927	1.8280890880755754	false	max_drawdown	1.6892583181588927	1.9332754871509052	0.23455321202267876	0.1799511368162339	0.3654580152671756				23.06542545929551	change_portfolio_params	[compacted 1513 paths; full backup: results.pre_compact_20260629_ledger_fieldlimit.tsv]	configs/strategies/ml_factor/autoresearch/v1_runs/ml_factor_classifier_v1/068_threshold_38_rank_score_fallback3_max8_no_sl	probability_threshold=0.38 rank_col=score fallback_min_positions=3 max_positions=8 no SL/TP
69	069_threshold_38_rank_score_fallback3_max6_forward15	5d41830	discard	continue	sharpe	1.285425956513965	1.8280890880755754	false	max_drawdown	1.285425956513965	1.47077178767726	0.22128062922444403	0.21262778348646072	0.3544847328244275				14.9689432089217	tune_hyperparams	[compacted 1537 paths; full backup: results.pre_compact_20260629_ledger_fieldlimit.tsv]	configs/strategies/ml_factor/autoresearch/v1_runs/ml_factor_classifier_v1/069_threshold_38_rank_score_fallback3_max6_forward15	probability_threshold=0.38 rank_col=score fallback_min_positions=3 max_positions=6 forward_period=15
70	070_threshold_38_rank_score_fallback3_max6_forward8	5d41830	discard	continue	sharpe	1.0586068822957064	1.8280890880755754	false		1.0586068822957064	1.188963231003897	0.17213798515334222	0.2968375021122706	0.3573473282442748				10.71081744786352	tune_hyperparams	[compacted 1561 paths; full backup: results.pre_compact_20260629_ledger_fieldlimit.tsv]	configs/strategies/ml_factor/autoresearch/v1_runs/ml_factor_classifier_v1/070_threshold_38_rank_score_fallback3_max6_forward8	probability_threshold=0.38 rank_col=score fallback_min_positions=3 max_positions=6 forward_period=8
71	071_threshold_38_fallback3_max6_scores_top_heavy	5d41830	discard	continue	sharpe	1.6646413586194495	1.8280890880755754	false	max_drawdown	1.6646413586194495	1.913365127328685	0.309096324929351	0.23492538662928533	0.3640267175572519				15.018107373267412	tune_hyperparams	[compacted 1585 paths; full backup: results.pre_compact_20260629_ledger_fieldlimit.tsv]	configs/strategies/ml_factor/autoresearch/v1_runs/ml_factor_classifier_v1/071_threshold_38_fallback3_max6_scores_top_heavy	probability_threshold=0.38 fallback_min_positions=3 max_positions=6 class_scores=-2,-1,0,0.5,3
72	072_threshold_38_fallback3_max6_scores_mild_top	5d41830	discard	continue	sharpe	1.7183740411548472	1.8280890880755754	false	max_drawdown	1.7183740411548472	1.9770095390097984	0.31976551818548304	0.23492538678407532	0.3654580152671756				10.350192056037486	tune_hyperparams	[compacted 1609 paths; full backup: results.pre_compact_20260629_ledger_fieldlimit.tsv]	configs/strategies/ml_factor/autoresearch/v1_runs/ml_factor_classifier_v1/072_threshold_38_fallback3_max6_scores_mild_top	probability_threshold=0.38 fallback_min_positions=3 max_positions=6 class_scores=-1,-0.5,0,1,3
73	073_threshold_38_rank_probsum_fallback3_max6_scores_mild_top	5d41830	discard	continue	sharpe	1.6915341611048065	1.8280890880755754	false	max_drawdown	1.6915341611048065	1.9384054387674543	0.31473515442564803	0.24603863518469887	0.3654580152671756				12.46608654083684	tune_hyperparams	[compacted 1633 paths; full backup: results.pre_compact_20260629_ledger_fieldlimit.tsv]	configs/strategies/ml_factor/autoresearch/v1_runs/ml_factor_classifier_v1/073_threshold_38_rank_probsum_fallback3_max6_scores_mild_top	probability_threshold=0.38 rank_col=class_3_4_prob fallback_min_positions=3 max_positions=6 class_scores=-1,-0.5,0,1,3
74	074_threshold_38_fallback3_max6_scores_midboost	5d41830	discard	continue	sharpe	1.6686111804779922	1.8280890880755754	false	max_drawdown	1.6686111804779922	1.905459848258345	0.30574819901476746	0.2373452950148566	0.36498091603053434				16.725219815969467	tune_hyperparams	[compacted 1657 paths; full backup: results.pre_compact_20260629_ledger_fieldlimit.tsv]	configs/strategies/ml_factor/autoresearch/v1_runs/ml_factor_classifier_v1/074_threshold_38_fallback3_max6_scores_midboost	probability_threshold=0.38 rank_col=score fallback_min_positions=3 max_positions=6 class_scores=-1,-0.5,0,1.5,3
75	075_threshold_38_fallback3_max6_scores_top4	5d41830	discard	continue	sharpe	1.6664266424537575	1.8280890880755754	false		1.6664266424537575	1.9034245767184592	0.3074106350392971	0.2517520222602975	0.36688931297709926				13.725608950015157	tune_hyperparams	[compacted 1681 paths; full backup: results.pre_compact_20260629_ledger_fieldlimit.tsv]	configs/strategies/ml_factor/autoresearch/v1_runs/ml_factor_classifier_v1/075_threshold_38_fallback3_max6_scores_top4	probability_threshold=0.38 rank_col=score fallback_min_positions=3 max_positions=6 class_scores=-1,-0.5,0,1,4
76	076_threshold_38_fallback3_max6_scores_mild_stop_loss15	5d41830	discard	continue	sharpe	1.6965930190292384	1.8280890880755754	false	max_drawdown	1.6965930190292384	1.9343816855624738	0.30730851680066595	0.19637422466027743	0.36593511450381677				12.06937082996592	stop_take_profit_rule	[compacted 1705 paths; full backup: results.pre_compact_20260629_ledger_fieldlimit.tsv]	configs/strategies/ml_factor/autoresearch/v1_runs/ml_factor_classifier_v1/076_threshold_38_fallback3_max6_scores_mild_stop_loss15	probability_threshold=0.38 rank_col=score fallback_min_positions=3 max_positions=6 class_scores=-1,-0.5,0,1,3 stop_loss=0.15
77	077_threshold_38_fallback3_max6_scores_mild_stop_loss20	5d41830	discard	continue	sharpe	1.7082629450468843	1.8280890880755754	false	max_drawdown	1.7082629450468843	1.9538139362377682	0.3151099083944089	0.2178616549918726	0.36593511450381677				18.133251854218543	stop_take_profit_rule	[compacted 1729 paths; full backup: results.pre_compact_20260629_ledger_fieldlimit.tsv]	configs/strategies/ml_factor/autoresearch/v1_runs/ml_factor_classifier_v1/077_threshold_38_fallback3_max6_scores_mild_stop_loss20	probability_threshold=0.38 rank_col=score fallback_min_positions=3 max_positions=6 class_scores=-1,-0.5,0,1,3 stop_loss=0.20
78	078_threshold_38_fallback3_max7_scores_mild_no_sl	5d41830	discard	continue	sharpe	1.7166478015623365	1.8280890880755754	false	max_drawdown	1.7166478015623365	1.9730886649065675	0.27349331364025287	0.20403140368021466	0.3654580152671756				10.450290360022336	change_portfolio_params	[compacted 1753 paths; full backup: results.pre_compact_20260629_ledger_fieldlimit.tsv]	configs/strategies/ml_factor/autoresearch/v1_runs/ml_factor_classifier_v1/078_threshold_38_fallback3_max7_scores_mild_no_sl	probability_threshold=0.38 rank_col=score fallback_min_positions=3 max_positions=7 class_scores=-1,-0.5,0,1,3 no SL/TP
79	079_threshold_38_fallback3_max8_scores_mild_no_sl	5d41830	discard	quota_exhausted	sharpe	1.7150137992826142	1.8280890880755754	false	max_drawdown	1.7150137992826142	1.9692446127129926	0.23878742018141064	0.1802970067840844	0.3654580152671756				12.717546516098082	change_portfolio_params	[compacted 1777 paths; full backup: results.pre_compact_20260629_ledger_fieldlimit.tsv]	configs/strategies/ml_factor/autoresearch/v1_runs/ml_factor_classifier_v1/079_threshold_38_fallback3_max8_scores_mild_no_sl	probability_threshold=0.38 rank_col=score fallback_min_positions=3 max_positions=8 class_scores=-1,-0.5,0,1,3 no SL/TP
