trial	run_id	commit	status	stop_reason	objective_metric	objective_value	best_value	criteria_hit	hit_metric	sharpe	sortino	cagr	max_drawdown	win_rate	signal_rows	featured_rows	predictor_count	wall_seconds	idea_family	changed_files	artifact_dir	description
17	017_rank_score_stop_loss_10	5d41830	discard	continue	sharpe	1.2875807457818518	1.4502032808497105	false	max_drawdown	1.2875807457818518	1.214543822845446	0.21105433040071842	0.20222046634531107	0.2705152671755725				12.762208841275424	stop_take_profit_rule	[compacted 362 paths; full backup: results.pre_compact_20260629_ledger_fieldlimit.tsv]	configs/strategies/ml_factor/autoresearch/v1_runs/ml_factor_classifier_v1/017_rank_score_stop_loss_10	rank_col=score stop_loss=0.10
18	018_rank_score_stop_loss_20	5d41830	discard	continue	sharpe	1.2721497164786768	1.4502032808497105	false	max_drawdown	1.2721497164786768	1.23171942093156	0.21134821271485071	0.19174645120793768	0.2943702290076336				15.06936062593013	stop_take_profit_rule	[compacted 386 paths; full backup: results.pre_compact_20260629_ledger_fieldlimit.tsv]	configs/strategies/ml_factor/autoresearch/v1_runs/ml_factor_classifier_v1/018_rank_score_stop_loss_20	rank_col=score stop_loss=0.20
19	019_rank_score_take_profit_30	5d41830	discard	continue	sharpe	1.3692956166786312	1.4502032808497105	false	max_drawdown	1.3692956166786312	1.3449189253129907	0.22623214896017796	0.240272802752034	0.3077290076335878				12.473807596135885	stop_take_profit_rule	[compacted 410 paths; full backup: results.pre_compact_20260629_ledger_fieldlimit.tsv]	configs/strategies/ml_factor/autoresearch/v1_runs/ml_factor_classifier_v1/019_rank_score_take_profit_30	rank_col=score take_profit=0.30
20	020_rank_score_fallback_1	5d41830	keep	continue	sharpe	1.6881479182323962	1.6881479182323962	false	max_drawdown	1.6881479182323962	1.783158864377031	0.2906582572943124	0.19920635042220192	0.3425572519083969				13.36187449702993	change_portfolio_params	[compacted 434 paths; full backup: results.pre_compact_20260629_ledger_fieldlimit.tsv]	configs/strategies/ml_factor/autoresearch/v1_runs/ml_factor_classifier_v1/020_rank_score_fallback_1	rank_col=score fallback_min_positions=1
21	021_rank_score_fallback_2	5d41830	keep	continue	sharpe	1.723854421111054	1.723854421111054	false		1.723854421111054	1.925408353218291	0.3379310915964484	0.2544125476523602	0.3630725190839695				13.865691570099443	change_portfolio_params	[compacted 458 paths; full backup: results.pre_compact_20260629_ledger_fieldlimit.tsv]	configs/strategies/ml_factor/autoresearch/v1_runs/ml_factor_classifier_v1/021_rank_score_fallback_2	rank_col=score fallback_min_positions=2
22	022_rank_score_fallback_2_stop_loss_20	5d41830	discard	continue	sharpe	1.7201303101833028	1.723854421111054	false	max_drawdown	1.7201303101833028	1.9019298087485468	0.33923145348868045	0.24732039353857815	0.366412213740458				10.253207851201296	stop_take_profit_rule	[compacted 482 paths; full backup: results.pre_compact_20260629_ledger_fieldlimit.tsv]	configs/strategies/ml_factor/autoresearch/v1_runs/ml_factor_classifier_v1/022_rank_score_fallback_2_stop_loss_20	rank_col=score fallback_min_positions=2 stop_loss=0.20
23	023_rank_score_fallback_3	5d41830	keep	continue	sharpe	1.7974416674903662	1.7974416674903662	false		1.7974416674903662	2.023772654416782	0.4230421358104106	0.2600249382183535	0.36736641221374045				12.16175179136917	change_portfolio_params	[compacted 506 paths; full backup: results.pre_compact_20260629_ledger_fieldlimit.tsv]	configs/strategies/ml_factor/autoresearch/v1_runs/ml_factor_classifier_v1/023_rank_score_fallback_3	rank_col=score fallback_min_positions=3
24	024_rank_score_fallback_3_stop_loss_20	5d41830	discard	continue	sharpe	1.7598512410184974	1.7974416674903662	false	max_drawdown	1.7598512410184974	1.968068442370982	0.3952410035252052	0.2428966915901412	0.37070610687022904				10.210214242804796	stop_take_profit_rule	[compacted 530 paths; full backup: results.pre_compact_20260629_ledger_fieldlimit.tsv]	configs/strategies/ml_factor/autoresearch/v1_runs/ml_factor_classifier_v1/024_rank_score_fallback_3_stop_loss_20	rank_col=score fallback_min_positions=3 stop_loss=0.20
25	025_rank_score_fallback_3_max_positions_4	5d41830	discard	continue	sharpe	1.7024875234243206	1.7974416674903662	false		1.7024875234243206	1.9455653525547258	0.4455490330529812	0.3145735456094225	0.3630725190839695				16.929352588020265	change_portfolio_params	[compacted 554 paths; full backup: results.pre_compact_20260629_ledger_fieldlimit.tsv]	configs/strategies/ml_factor/autoresearch/v1_runs/ml_factor_classifier_v1/025_rank_score_fallback_3_max_positions_4	rank_col=score fallback_min_positions=3 max_positions=4
26	026_rank_score_fallback_4	5d41830	discard	continue	sharpe	1.689703756699408	1.7974416674903662	false		1.689703756699408	1.8918269276784003	0.4316148594805693	0.32479498612679586	0.35782442748091603				17.085050635039806	change_portfolio_params	[compacted 578 paths; full backup: results.pre_compact_20260629_ledger_fieldlimit.tsv]	configs/strategies/ml_factor/autoresearch/v1_runs/ml_factor_classifier_v1/026_rank_score_fallback_4	rank_col=score fallback_min_positions=4
27	027_rank_score_fallback_3_threshold_025	5d41830	discard	continue	sharpe	1.3711407198489105	1.7974416674903662	false		1.3711407198489105	1.4713586144915274	0.34831960201636636	0.2843357641246119	0.36211832061068705				10.962419833987951	change_portfolio_params	[compacted 602 paths; full backup: results.pre_compact_20260629_ledger_fieldlimit.tsv]	configs/strategies/ml_factor/autoresearch/v1_runs/ml_factor_classifier_v1/027_rank_score_fallback_3_threshold_025	rank_col=score fallback_min_positions=3 probability_threshold=0.25
28	028_rank_score_fallback_3_threshold_032	5d41830	discard	continue	sharpe	1.6293095109115654	1.7974416674903662	false		1.6293095109115654	1.8217622630677903	0.36464587993352526	0.26002342590708244	0.36927480916030536				10.065010490827262	change_portfolio_params	[compacted 626 paths; full backup: results.pre_compact_20260629_ledger_fieldlimit.tsv]	configs/strategies/ml_factor/autoresearch/v1_runs/ml_factor_classifier_v1/028_rank_score_fallback_3_threshold_032	rank_col=score fallback_min_positions=3 probability_threshold=0.32
29	029_rank_score_fallback_3_train_504	5d41830	discard	continue	sharpe	1.0153765011863498	1.7974416674903662	false		1.0153765011863498	1.0629164114197336	0.23117133000897083	0.4284076946621453	0.3592557251908397				11.724719780031592	tune_hyperparams	[compacted 650 paths; full backup: results.pre_compact_20260629_ledger_fieldlimit.tsv]	configs/strategies/ml_factor/autoresearch/v1_runs/ml_factor_classifier_v1/029_rank_score_fallback_3_train_504	rank_col=score fallback_min_positions=3 train_window=504
30	030_rank_score_fallback_3_class_window_252	5d41830	discard	continue	sharpe	1.2963641540965296	1.7974416674903662	false		1.2963641540965296	1.3639156042731213	0.31626847810779735	0.3287777292143735	0.36927480916030536				10.048203845974058	tune_hyperparams	[compacted 674 paths; full backup: results.pre_compact_20260629_ledger_fieldlimit.tsv]	configs/strategies/ml_factor/autoresearch/v1_runs/ml_factor_classifier_v1/030_rank_score_fallback_3_class_window_252	rank_col=score fallback_min_positions=3 classification_window=252
31	031_rank_score_fallback_3_max_positions_6	5d41830	keep	continue	sharpe	1.8075242427328562	1.8075242427328562	false	sharpe	1.8075242427328562	2.0241581263277024	0.37932538719852915	0.26345661749263155	0.36450381679389315				16.836292850319296	change_portfolio_params	[compacted 698 paths; full backup: results.pre_compact_20260629_ledger_fieldlimit.tsv]	configs/strategies/ml_factor/autoresearch/v1_runs/ml_factor_classifier_v1/031_rank_score_fallback_3_max_positions_6	rank_col=score fallback_min_positions=3 max_positions=6
32	032_rank_score_fallback_3_max_positions_6_stop_loss_20	5d41830	discard	continue	sharpe	1.7504110399197488	1.8075242427328562	false	max_drawdown	1.7504110399197488	1.9468023726431456	0.3461271094055902	0.24588633509340876	0.36927480916030536				11.00743609899655	stop_take_profit_rule	[compacted 722 paths; full backup: results.pre_compact_20260629_ledger_fieldlimit.tsv]	configs/strategies/ml_factor/autoresearch/v1_runs/ml_factor_classifier_v1/032_rank_score_fallback_3_max_positions_6_stop_loss_20	rank_col=score fallback_min_positions=3 max_positions=6 stop_loss=0.20
33	033_rank_score_fallback_2_max_positions_6	5d41830	discard	continue	sharpe	1.706819122147401	1.8075242427328562	false		1.706819122147401	1.859200291616119	0.2976276812456107	0.2589946798696696	0.36259541984732824				13.469865119084716	change_portfolio_params	[compacted 746 paths; full backup: results.pre_compact_20260629_ledger_fieldlimit.tsv]	configs/strategies/ml_factor/autoresearch/v1_runs/ml_factor_classifier_v1/033_rank_score_fallback_2_max_positions_6	rank_col=score fallback_min_positions=2 max_positions=6
34	034_rank_score_fallback_3_max_positions_6_take_profit_30	5d41830	discard	continue	sharpe	1.6905511810269318	1.8075242427328562	false		1.6905511810269318	1.869487148403878	0.320688972131532	0.2899072545324004	0.36593511450381677				10.458514327649027	stop_take_profit_rule	[compacted 770 paths; full backup: results.pre_compact_20260629_ledger_fieldlimit.tsv]	configs/strategies/ml_factor/autoresearch/v1_runs/ml_factor_classifier_v1/034_rank_score_fallback_3_max_positions_6_take_profit_30	rank_col=score fallback_min_positions=3 max_positions=6 take_profit=0.30
35	035_rank_score_fallback_3_max_positions_7	5d41830	discard	continue	sharpe	1.649991358248622	1.8075242427328562	false		1.649991358248622	1.7684279076570237	0.3108435153920437	0.2899535654793481	0.36593511450381677				10.104778100270778	change_portfolio_params	[compacted 794 paths; full backup: results.pre_compact_20260629_ledger_fieldlimit.tsv]	configs/strategies/ml_factor/autoresearch/v1_runs/ml_factor_classifier_v1/035_rank_score_fallback_3_max_positions_7	rank_col=score fallback_min_positions=3 max_positions=7
36	036_rank_score_fallback_3_max_positions_6_rebalance_5	5d41830	discard	continue	sharpe	1.3139783164364645	1.8075242427328562	false		1.3139783164364645	1.3885636619267283	0.26017924748158916	0.36799252232300594	0.3606870229007634				22.005562637001276	tune_hyperparams	[compacted 818 paths; full backup: results.pre_compact_20260629_ledger_fieldlimit.tsv]	configs/strategies/ml_factor/autoresearch/v1_runs/ml_factor_classifier_v1/036_rank_score_fallback_3_max_positions_6_rebalance_5	rank_col=score fallback_min_positions=3 max_positions=6 rebalance_frequency=5
37	037_rank_score_fallback_3_max_positions_6_rebalance_15	5d41830	discard	continue	sharpe	1.3102949873354137	1.8075242427328562	false		1.3102949873354137	1.3700626308584287	0.25407030151157617	0.2908036205090187	0.3511450381679389				8.294894621707499	tune_hyperparams	[compacted 842 paths; full backup: results.pre_compact_20260629_ledger_fieldlimit.tsv]	configs/strategies/ml_factor/autoresearch/v1_runs/ml_factor_classifier_v1/037_rank_score_fallback_3_max_positions_6_rebalance_15	rank_col=score fallback_min_positions=3 max_positions=6 rebalance_frequency=15
38	038_rank_score_fallback_3_max_positions_6_stop_loss_25	5d41830	discard	continue	sharpe	1.7310472537862793	1.8075242427328562	false		1.7310472537862793	1.9220616184581678	0.3433807282831862	0.2538738492457609	0.3683206106870229				14.472123456187546	stop_take_profit_rule	[compacted 866 paths; full backup: results.pre_compact_20260629_ledger_fieldlimit.tsv]	configs/strategies/ml_factor/autoresearch/v1_runs/ml_factor_classifier_v1/038_rank_score_fallback_3_max_positions_6_stop_loss_25	rank_col=score fallback_min_positions=3 max_positions=6 stop_loss=0.25
39	039_rank_score_fallback_3_max_positions_6_threshold_032	5d41830	discard	continue	sharpe	1.6000128331809818	1.8075242427328562	false		1.6000128331809818	1.7563577699944104	0.3104125464776675	0.29067669104621924	0.366412213740458				10.10821482585743	change_portfolio_params	[compacted 890 paths; full backup: results.pre_compact_20260629_ledger_fieldlimit.tsv]	configs/strategies/ml_factor/autoresearch/v1_runs/ml_factor_classifier_v1/039_rank_score_fallback_3_max_positions_6_threshold_032	rank_col=score fallback_min_positions=3 max_positions=6 probability_threshold=0.32
40	040_rank_score_fallback_3_max_positions_6_threshold_028	5d41830	discard	continue	sharpe	1.389587220273447	1.8075242427328562	false		1.389587220273447	1.487419845222977	0.3387051127068892	0.26648607477079006	0.3606870229007634				17.139838350005448	change_portfolio_params	[compacted 914 paths; full backup: results.pre_compact_20260629_ledger_fieldlimit.tsv]	configs/strategies/ml_factor/autoresearch/v1_runs/ml_factor_classifier_v1/040_rank_score_fallback_3_max_positions_6_threshold_028	rank_col=score fallback_min_positions=3 max_positions=6 probability_threshold=0.28
41	041_rank_score_fallback_3_max_positions_6_stop_loss_20_exit_only	5d41830	keep	continue	sharpe	1.8273926444640762	1.8273926444640762	false	sharpe	1.8273926444640762	2.0525727083361436	0.38172327492591096	0.26038185640051315	0.3640267175572519				10.255166386254132	stop_take_profit_rule	[compacted 938 paths; full backup: results.pre_compact_20260629_ledger_fieldlimit.tsv]	configs/strategies/ml_factor/autoresearch/v1_runs/ml_factor_classifier_v1/041_rank_score_fallback_3_max_positions_6_stop_loss_20_exit_only	rank_col=score fallback_min_positions=3 max_positions=6 exit-only stop_loss=0.20
42	042_rank_score_fallback_3_max_positions_6_stop_loss_15_exit_only	5d41830	keep	criteria_met	sharpe	1.8280890880755754	1.8280890880755754	true	sharpe,max_drawdown	1.8280890880755754	2.060930245057111	0.38273295437698485	0.2376773522087675	0.3630725190839695				10.255020878277719	stop_take_profit_rule	[compacted 962 paths; full backup: results.pre_compact_20260629_ledger_fieldlimit.tsv]	configs/strategies/ml_factor/autoresearch/v1_runs/ml_factor_classifier_v1/042_rank_score_fallback_3_max_positions_6_stop_loss_15_exit_only	rank_col=score fallback_min_positions=3 max_positions=6 exit-only stop_loss=0.15
43	043_strict_class_3_4_threshold_50_stop_loss_15	5d41830	crash	continue	sharpe		1.8280890880755754	false										7.697888916824013	change_portfolio_params	[compacted 968 paths; full backup: results.pre_compact_20260629_ledger_fieldlimit.tsv]	configs/strategies/ml_factor/autoresearch/v1_runs/ml_factor_classifier_v1/043_strict_class_3_4_threshold_50_stop_loss_15	strict predicted_class>=3 and class_3_4_prob>0.50 with no fallback
44	044_strict_class_3_4_threshold_50_clear_guard	5d41830	crash	continue	sharpe		1.8280890880755754	false										6.890250850003213	change_portfolio_params	[compacted 973 paths; full backup: results.pre_compact_20260629_ledger_fieldlimit.tsv]	configs/strategies/ml_factor/autoresearch/v1_runs/ml_factor_classifier_v1/044_strict_class_3_4_threshold_50_clear_guard	strict predicted_class>=3 and class_3_4_prob>0.50 with explicit no-signal guard
45	045_train_threshold_balanced_strict_class_3_4	5d41830	crash	continue	sharpe		1.8280890880755754	false										13.614484295714647	tune_hyperparams	[compacted 978 paths; full backup: results.pre_compact_20260629_ledger_fieldlimit.tsv]	configs/strategies/ml_factor/autoresearch/v1_runs/ml_factor_classifier_v1/045_train_threshold_balanced_strict_class_3_4	train-scope classification thresholds plus balanced sample weights under strict predicted_class>=3 and class_3_4_prob>0.50
46	046_train_threshold_balanced_diagnostics	5d41830	crash	continue	sharpe		1.8280890880755754	false										8.439635796006769	tune_hyperparams	[compacted 985 paths; full backup: results.pre_compact_20260629_ledger_fieldlimit.tsv]	configs/strategies/ml_factor/autoresearch/v1_runs/ml_factor_classifier_v1/046_train_threshold_balanced_diagnostics	train-scope thresholds and balanced sample weights; exported no-signal prediction diagnostics under strict 0.50 class_3_4 gate
47	047_threshold_40_strict_class3_stop_loss15	5d41830	discard	continue	sharpe	1.1070438181880986	1.8280890880755754	false		1.1070438181880986	1.174936465568816	0.2520683239377932	0.39418746815098293	0.35877862595419846				28.683320445008576	stop_take_profit_rule	[compacted 1009 paths; full backup: results.pre_compact_20260629_ledger_fieldlimit.tsv]	configs/strategies/ml_factor/autoresearch/v1_runs/ml_factor_classifier_v1/047_threshold_40_strict_class3_stop_loss15	probability_threshold=0.40 strict class>=3 max_positions=6 stop_loss=0.15
48	048_threshold_40_fallback3_max6_stop_loss15	5d41830	discard	continue	sharpe	1.1070438181880986	1.8280890880755754	false		1.1070438181880986	1.174936465568816	0.2520683239377932	0.39418746815098293	0.35877862595419846				26.123234902974218	stop_take_profit_rule	[compacted 1033 paths; full backup: results.pre_compact_20260629_ledger_fieldlimit.tsv]	configs/strategies/ml_factor/autoresearch/v1_runs/ml_factor_classifier_v1/048_threshold_40_fallback3_max6_stop_loss15	probability_threshold=0.40 fallback_min_positions=3 max_positions=6 stop_loss=0.15
49	049_threshold_40_rank_config_fallback3_max6_stop_loss15	5d41830	discard	continue	sharpe	1.6519350796315597	1.8280890880755754	false	max_drawdown	1.6519350796315597	1.879269399397246	0.2975979963873252	0.23105024387504933	0.3640267175572519				17.182262242306024	stop_take_profit_rule	[compacted 1057 paths; full backup: results.pre_compact_20260629_ledger_fieldlimit.tsv]	configs/strategies/ml_factor/autoresearch/v1_runs/ml_factor_classifier_v1/049_threshold_40_rank_config_fallback3_max6_stop_loss15	rank-score autoresearch config probability_threshold=0.40 fallback_min_positions=3 max_positions=6 stop_loss=0.15
50	050_threshold_40_rank_config_fallback3_max6_no_sl	5d41830	discard	continue	sharpe	1.6905793265005447	1.8280890880755754	false	max_drawdown	1.6905793265005447	1.9383611773868616	0.3137510763560454	0.23430343298865605	0.36593511450381677				24.056653697043657	change_portfolio_params	[compacted 1081 paths; full backup: results.pre_compact_20260629_ledger_fieldlimit.tsv]	configs/strategies/ml_factor/autoresearch/v1_runs/ml_factor_classifier_v1/050_threshold_40_rank_config_fallback3_max6_no_sl	rank-score autoresearch config probability_threshold=0.40 fallback_min_positions=3 max_positions=6 no SL/TP
51	051_threshold_40_rank_config_fallback3_max5_no_sl	5d41830	discard	continue	sharpe	1.644623407417798	1.8280890880755754	false		1.644623407417798	1.8697153334475325	0.3579406812010131	0.2758635887434007	0.36688931297709926				13.616624344140291	change_portfolio_params	[compacted 1105 paths; full backup: results.pre_compact_20260629_ledger_fieldlimit.tsv]	configs/strategies/ml_factor/autoresearch/v1_runs/ml_factor_classifier_v1/051_threshold_40_rank_config_fallback3_max5_no_sl	probability_threshold=0.40 rank-score config fallback_min_positions=3 max_positions=5 no SL/TP
52	052_threshold_40_rank_config_fallback3_max7_no_sl	5d41830	discard	continue	sharpe	1.6898829212597963	1.8280890880755754	false	max_drawdown	1.6898829212597963	1.9356191071764886	0.2684770260023701	0.20357684648075364	0.3654580152671756				13.759852254763246	change_portfolio_params	[compacted 1129 paths; full backup: results.pre_compact_20260629_ledger_fieldlimit.tsv]	configs/strategies/ml_factor/autoresearch/v1_runs/ml_factor_classifier_v1/052_threshold_40_rank_config_fallback3_max7_no_sl	probability_threshold=0.40 rank-score config fallback_min_positions=3 max_positions=7 no SL/TP
53	053_threshold_40_rank_config_fallback2_max6_no_sl	5d41830	discard	continue	sharpe	1.6174508100084157	1.8280890880755754	false	max_drawdown	1.6174508100084157	1.9286963864205997	0.20891561710902629	0.21633812844198538	0.36354961832061067				11.1623030686751	change_portfolio_params	[compacted 1153 paths; full backup: results.pre_compact_20260629_ledger_fieldlimit.tsv]	configs/strategies/ml_factor/autoresearch/v1_runs/ml_factor_classifier_v1/053_threshold_40_rank_config_fallback2_max6_no_sl	probability_threshold=0.40 rank-score config fallback_min_positions=2 max_positions=6 no SL/TP
54	054_threshold_38_rank_config_fallback3_max6_no_sl	5d41830	discard	continue	sharpe	1.6905793265005447	1.8280890880755754	false	max_drawdown	1.6905793265005447	1.9383611773868616	0.3137510763560454	0.23430343298865605	0.36593511450381677				11.105877879075706	change_portfolio_params	[compacted 1177 paths; full backup: results.pre_compact_20260629_ledger_fieldlimit.tsv]	configs/strategies/ml_factor/autoresearch/v1_runs/ml_factor_classifier_v1/054_threshold_38_rank_config_fallback3_max6_no_sl	probability_threshold=0.38 rank-score config fallback_min_positions=3 max_positions=6 no SL/TP
55	055_threshold_38_rank_config_fallback3_max6_stop_loss15	5d41830	discard	continue	sharpe	1.6519350796315597	1.8280890880755754	false	max_drawdown	1.6519350796315597	1.879269399397246	0.2975979963873252	0.23105024387504933	0.3640267175572519				21.702403663191944	stop_take_profit_rule	[compacted 1201 paths; full backup: results.pre_compact_20260629_ledger_fieldlimit.tsv]	configs/strategies/ml_factor/autoresearch/v1_runs/ml_factor_classifier_v1/055_threshold_38_rank_config_fallback3_max6_stop_loss15	probability_threshold=0.38 rank-score config fallback_min_positions=3 max_positions=6 stop_loss=0.15
56	056_threshold_38_rank_config_fallback4_max6_no_sl	5d41830	discard	continue	sharpe	1.4559981349269815	1.8280890880755754	false		1.4559981349269815	1.60828741469903	0.3169740447326601	0.28135923595689655	0.36020992366412213				16.479670363944024	change_portfolio_params	[compacted 1225 paths; full backup: results.pre_compact_20260629_ledger_fieldlimit.tsv]	configs/strategies/ml_factor/autoresearch/v1_runs/ml_factor_classifier_v1/056_threshold_38_rank_config_fallback4_max6_no_sl	probability_threshold=0.38 rank-score config fallback_min_positions=4 max_positions=6 no SL/TP
