trial	run_id	commit	status	stop_reason	objective_metric	objective_value	best_value	criteria_hit	hit_metric	sharpe	sortino	cagr	max_drawdown	win_rate	signal_rows	featured_rows	predictor_count	wall_seconds	idea_family	changed_files	artifact_dir	description
0	000_baseline	5d41830	crash	continue	sharpe			false										1.9200813388451934	tune_hyperparams	configs/strategies/ml_factor/autoresearch/v1_ledger/worktree_snapshot.json;configs/strategies/ml_factor/autoresearch/v1_runs/ml_factor_classifier_v1/000_baseline/command.json;configs/strategies/ml_factor/autoresearch/v1_runs/ml_factor_classifier_v1/000_baseline/metrics.json;configs/strategies/ml_factor/autoresearch/v1_runs/ml_factor_classifier_v1/000_baseline/run.log;configs/strategies/ml_factor/autoresearch/v1_runs/ml_factor_classifier_v1/000_baseline/trial_config.yaml	configs/strategies/ml_factor/autoresearch/v1_runs/ml_factor_classifier_v1/000_baseline	baseline attempt before parameter trials
1	001_baseline_import_fix	5d41830	crash	continue	sharpe			false										1.6695135100744665	tune_hyperparams	configs/strategies/ml_factor/autoresearch/v1_runs/ml_factor_classifier_v1/001_baseline_import_fix/command.json;configs/strategies/ml_factor/autoresearch/v1_runs/ml_factor_classifier_v1/001_baseline_import_fix/metrics.json;configs/strategies/ml_factor/autoresearch/v1_runs/ml_factor_classifier_v1/001_baseline_import_fix/run.log;configs/strategies/ml_factor/autoresearch/v1_runs/ml_factor_classifier_v1/001_baseline_import_fix/trial_config.yaml	configs/strategies/ml_factor/autoresearch/v1_runs/ml_factor_classifier_v1/001_baseline_import_fix	baseline after vectorbt import compatibility fix
2	002_baseline_template_class	5d41830	crash	continue	sharpe			false										2.3210079302079976	tune_hyperparams	configs/strategies/ml_factor/autoresearch/v1_runs/ml_factor_classifier_v1/002_baseline_template_class/command.json;configs/strategies/ml_factor/autoresearch/v1_runs/ml_factor_classifier_v1/002_baseline_template_class/metrics.json;configs/strategies/ml_factor/autoresearch/v1_runs/ml_factor_classifier_v1/002_baseline_template_class/run.log;configs/strategies/ml_factor/autoresearch/v1_runs/ml_factor_classifier_v1/002_baseline_template_class/trial_config.yaml	configs/strategies/ml_factor/autoresearch/v1_runs/ml_factor_classifier_v1/002_baseline_template_class	baseline after plotly template class compatibility fix
3	003_baseline_relative_config	5d41830	keep	continue	sharpe	1.0677473997119353	1.0677473997119353	false		1.0677473997119353	1.024257930393813	0.17414787685810063	0.2857636208574488	0.3277671755725191				18.684417102020234	tune_hyperparams	configs/strategies/ml_factor/autoresearch/v1_runs/ml_factor_classifier_v1/003_baseline_relative_config/command.json;configs/strategies/ml_factor/autoresearch/v1_runs/ml_factor_classifier_v1/003_baseline_relative_config/dataset_summary.csv;configs/strategies/ml_factor/autoresearch/v1_runs/ml_factor_classifier_v1/003_baseline_relative_config/effective_config.yaml;configs/strategies/ml_factor/autoresearch/v1_runs/ml_factor_classifier_v1/003_baseline_relative_config/manifest.json;configs/strategies/ml_factor/autoresearch/v1_runs/ml_factor_classifier_v1/003_baseline_relative_config/metrics.json;configs/strategies/ml_factor/autoresearch/v1_runs/ml_factor_classifier_v1/003_baseline_relative_config/model_frame.csv;configs/strategies/ml_factor/autoresearch/v1_runs/ml_factor_classifier_v1/003_baseline_relative_config/orders.csv;configs/strategies/ml_factor/autoresearch/v1_runs/ml_factor_classifier_v1/003_baseline_relative_config/orders_realized.csv;configs/strategies/ml_factor/autoresearch/v1_runs/ml_factor_classifier_v1/003_baseline_relative_config/orders_summary.csv;configs/strategies/ml_factor/autoresearch/v1_runs/ml_factor_classifier_v1/003_baseline_relative_config/params.csv;configs/strategies/ml_factor/autoresearch/v1_runs/ml_factor_classifier_v1/003_baseline_relative_config/portfolio.csv;configs/strategies/ml_factor/autoresearch/v1_runs/ml_factor_classifier_v1/003_baseline_relative_config/portfolio_stats.csv;configs/strategies/ml_factor/autoresearch/v1_runs/ml_factor_classifier_v1/003_baseline_relative_config/predictions.csv;configs/strategies/ml_factor/autoresearch/v1_runs/ml_factor_classifier_v1/003_baseline_relative_config/pyfolio_aligned_returns.csv;configs/strategies/ml_factor/autoresearch/v1_runs/ml_factor_classifier_v1/003_baseline_relative_config/pyfolio_stats.csv;configs/strategies/ml_factor/autoresearch/v1_runs/ml_factor_classifier_v1/003_baseline_relative_config/qts_metrics.csv;configs/strategies/ml_factor/autoresearch/v1_runs/ml_factor_classifier_v1/003_baseline_relative_config/run.log;configs/strategies/ml_factor/autoresearch/v1_runs/ml_factor_classifier_v1/003_baseline_relative_config/run_eval.csv;configs/strategies/ml_factor/autoresearch/v1_runs/ml_factor_classifier_v1/003_baseline_relative_config/selected_predictions.csv;configs/strategies/ml_factor/autoresearch/v1_runs/ml_factor_classifier_v1/003_baseline_relative_config/selected_realized_results.csv;configs/strategies/ml_factor/autoresearch/v1_runs/ml_factor_classifier_v1/003_baseline_relative_config/target_weights.csv;configs/strategies/ml_factor/autoresearch/v1_runs/ml_factor_classifier_v1/003_baseline_relative_config/trial_config.yaml;configs/strategies/ml_factor/autoresearch/v1_runs/ml_factor_classifier_v1/003_baseline_relative_config/vectorbt_orders.csv	configs/strategies/ml_factor/autoresearch/v1_runs/ml_factor_classifier_v1/003_baseline_relative_config	baseline after repo-relative config path fix
4	004_rank_score	5d41830	keep	continue	sharpe	1.4502032808497105	1.4502032808497105	false	max_drawdown	1.4502032808497105	1.496098847689778	0.24725774694677072	0.19920635040227147	0.3330152671755725				16.88181481603533	tune_hyperparams	configs/strategies/ml_factor/autoresearch/v1_ledger/next_steps.md;configs/strategies/ml_factor/autoresearch/v1_runs/ml_factor_classifier_v1/003_baseline_relative_config/command.json;configs/strategies/ml_factor/autoresearch/v1_runs/ml_factor_classifier_v1/003_baseline_relative_config/dataset_summary.csv;configs/strategies/ml_factor/autoresearch/v1_runs/ml_factor_classifier_v1/003_baseline_relative_config/effective_config.yaml;configs/strategies/ml_factor/autoresearch/v1_runs/ml_factor_classifier_v1/003_baseline_relative_config/manifest.json;configs/strategies/ml_factor/autoresearch/v1_runs/ml_factor_classifier_v1/003_baseline_relative_config/metrics.json;configs/strategies/ml_factor/autoresearch/v1_runs/ml_factor_classifier_v1/003_baseline_relative_config/model_frame.csv;configs/strategies/ml_factor/autoresearch/v1_runs/ml_factor_classifier_v1/003_baseline_relative_config/orders.csv;configs/strategies/ml_factor/autoresearch/v1_runs/ml_factor_classifier_v1/003_baseline_relative_config/orders_realized.csv;configs/strategies/ml_factor/autoresearch/v1_runs/ml_factor_classifier_v1/003_baseline_relative_config/orders_summary.csv;configs/strategies/ml_factor/autoresearch/v1_runs/ml_factor_classifier_v1/003_baseline_relative_config/params.csv;configs/strategies/ml_factor/autoresearch/v1_runs/ml_factor_classifier_v1/003_baseline_relative_config/portfolio.csv;configs/strategies/ml_factor/autoresearch/v1_runs/ml_factor_classifier_v1/003_baseline_relative_config/portfolio_stats.csv;configs/strategies/ml_factor/autoresearch/v1_runs/ml_factor_classifier_v1/003_baseline_relative_config/predictions.csv;configs/strategies/ml_factor/autoresearch/v1_runs/ml_factor_classifier_v1/003_baseline_relative_config/pyfolio_aligned_returns.csv;configs/strategies/ml_factor/autoresearch/v1_runs/ml_factor_classifier_v1/003_baseline_relative_config/pyfolio_stats.csv;configs/strategies/ml_factor/autoresearch/v1_runs/ml_factor_classifier_v1/003_baseline_relative_config/qts_metrics.csv;configs/strategies/ml_factor/autoresearch/v1_runs/ml_factor_classifier_v1/003_baseline_relative_config/run.log;configs/strategies/ml_factor/autoresearch/v1_runs/ml_factor_classifier_v1/003_baseline_relative_config/run_eval.csv;configs/strategies/ml_factor/autoresearch/v1_runs/ml_factor_classifier_v1/003_baseline_relative_config/selected_predictions.csv;configs/strategies/ml_factor/autoresearch/v1_runs/ml_factor_classifier_v1/003_baseline_relative_config/selected_realized_results.csv;configs/strategies/ml_factor/autoresearch/v1_runs/ml_factor_classifier_v1/003_baseline_relative_config/target_weights.csv;configs/strategies/ml_factor/autoresearch/v1_runs/ml_factor_classifier_v1/003_baseline_relative_config/trial_config.yaml;configs/strategies/ml_factor/autoresearch/v1_runs/ml_factor_classifier_v1/003_baseline_relative_config/trial_summary.md;configs/strategies/ml_factor/autoresearch/v1_runs/ml_factor_classifier_v1/003_baseline_relative_config/vectorbt_orders.csv;configs/strategies/ml_factor/autoresearch/v1_runs/ml_factor_classifier_v1/004_rank_score/command.json;configs/strategies/ml_factor/autoresearch/v1_runs/ml_factor_classifier_v1/004_rank_score/dataset_summary.csv;configs/strategies/ml_factor/autoresearch/v1_runs/ml_factor_classifier_v1/004_rank_score/effective_config.yaml;configs/strategies/ml_factor/autoresearch/v1_runs/ml_factor_classifier_v1/004_rank_score/manifest.json;configs/strategies/ml_factor/autoresearch/v1_runs/ml_factor_classifier_v1/004_rank_score/metrics.json;configs/strategies/ml_factor/autoresearch/v1_runs/ml_factor_classifier_v1/004_rank_score/model_frame.csv;configs/strategies/ml_factor/autoresearch/v1_runs/ml_factor_classifier_v1/004_rank_score/orders.csv;configs/strategies/ml_factor/autoresearch/v1_runs/ml_factor_classifier_v1/004_rank_score/orders_realized.csv;configs/strategies/ml_factor/autoresearch/v1_runs/ml_factor_classifier_v1/004_rank_score/orders_summary.csv;configs/strategies/ml_factor/autoresearch/v1_runs/ml_factor_classifier_v1/004_rank_score/params.csv;configs/strategies/ml_factor/autoresearch/v1_runs/ml_factor_classifier_v1/004_rank_score/portfolio.csv;configs/strategies/ml_factor/autoresearch/v1_runs/ml_factor_classifier_v1/004_rank_score/portfolio_stats.csv;configs/strategies/ml_factor/autoresearch/v1_runs/ml_factor_classifier_v1/004_rank_score/predictions.csv;configs/strategies/ml_factor/autoresearch/v1_runs/ml_factor_classifier_v1/004_rank_score/pyfolio_aligned_returns.csv;configs/strategies/ml_factor/autoresearch/v1_runs/ml_factor_classifier_v1/004_rank_score/pyfolio_stats.csv;configs/strategies/ml_factor/autoresearch/v1_runs/ml_factor_classifier_v1/004_rank_score/qts_metrics.csv;configs/strategies/ml_factor/autoresearch/v1_runs/ml_factor_classifier_v1/004_rank_score/run.log;configs/strategies/ml_factor/autoresearch/v1_runs/ml_factor_classifier_v1/004_rank_score/run_eval.csv;configs/strategies/ml_factor/autoresearch/v1_runs/ml_factor_classifier_v1/004_rank_score/selected_predictions.csv;configs/strategies/ml_factor/autoresearch/v1_runs/ml_factor_classifier_v1/004_rank_score/selected_realized_results.csv;configs/strategies/ml_factor/autoresearch/v1_runs/ml_factor_classifier_v1/004_rank_score/target_weights.csv;configs/strategies/ml_factor/autoresearch/v1_runs/ml_factor_classifier_v1/004_rank_score/trial_config.yaml;configs/strategies/ml_factor/autoresearch/v1_runs/ml_factor_classifier_v1/004_rank_score/trial_summary.md;configs/strategies/ml_factor/autoresearch/v1_runs/ml_factor_classifier_v1/004_rank_score/vectorbt_orders.csv	configs/strategies/ml_factor/autoresearch/v1_runs/ml_factor_classifier_v1/004_rank_score	rank_col=score
5	005_rank_score_max_positions_6	5d41830	discard	continue	sharpe	1.4240854954180446	1.4502032808497105	false	max_drawdown	1.4240854954180446	1.4331024372012666	0.21959905825211723	0.22026853993408324	0.3325381679389313				9.756748316343874	change_portfolio_params	configs/strategies/ml_factor/autoresearch/v1_ledger/next_steps.md;configs/strategies/ml_factor/autoresearch/v1_runs/ml_factor_classifier_v1/003_baseline_relative_config/command.json;configs/strategies/ml_factor/autoresearch/v1_runs/ml_factor_classifier_v1/003_baseline_relative_config/dataset_summary.csv;configs/strategies/ml_factor/autoresearch/v1_runs/ml_factor_classifier_v1/003_baseline_relative_config/effective_config.yaml;configs/strategies/ml_factor/autoresearch/v1_runs/ml_factor_classifier_v1/003_baseline_relative_config/manifest.json;configs/strategies/ml_factor/autoresearch/v1_runs/ml_factor_classifier_v1/003_baseline_relative_config/metrics.json;configs/strategies/ml_factor/autoresearch/v1_runs/ml_factor_classifier_v1/003_baseline_relative_config/model_frame.csv;configs/strategies/ml_factor/autoresearch/v1_runs/ml_factor_classifier_v1/003_baseline_relative_config/orders.csv;configs/strategies/ml_factor/autoresearch/v1_runs/ml_factor_classifier_v1/003_baseline_relative_config/orders_realized.csv;configs/strategies/ml_factor/autoresearch/v1_runs/ml_factor_classifier_v1/003_baseline_relative_config/orders_summary.csv;configs/strategies/ml_factor/autoresearch/v1_runs/ml_factor_classifier_v1/003_baseline_relative_config/params.csv;configs/strategies/ml_factor/autoresearch/v1_runs/ml_factor_classifier_v1/003_baseline_relative_config/portfolio.csv;configs/strategies/ml_factor/autoresearch/v1_runs/ml_factor_classifier_v1/003_baseline_relative_config/portfolio_stats.csv;configs/strategies/ml_factor/autoresearch/v1_runs/ml_factor_classifier_v1/003_baseline_relative_config/predictions.csv;configs/strategies/ml_factor/autoresearch/v1_runs/ml_factor_classifier_v1/003_baseline_relative_config/pyfolio_aligned_returns.csv;configs/strategies/ml_factor/autoresearch/v1_runs/ml_factor_classifier_v1/003_baseline_relative_config/pyfolio_stats.csv;configs/strategies/ml_factor/autoresearch/v1_runs/ml_factor_classifier_v1/003_baseline_relative_config/qts_metrics.csv;configs/strategies/ml_factor/autoresearch/v1_runs/ml_factor_classifier_v1/003_baseline_relative_config/run.log;configs/strategies/ml_factor/autoresearch/v1_runs/ml_factor_classifier_v1/003_baseline_relative_config/run_eval.csv;configs/strategies/ml_factor/autoresearch/v1_runs/ml_factor_classifier_v1/003_baseline_relative_config/selected_predictions.csv;configs/strategies/ml_factor/autoresearch/v1_runs/ml_factor_classifier_v1/003_baseline_relative_config/selected_realized_results.csv;configs/strategies/ml_factor/autoresearch/v1_runs/ml_factor_classifier_v1/003_baseline_relative_config/target_weights.csv;configs/strategies/ml_factor/autoresearch/v1_runs/ml_factor_classifier_v1/003_baseline_relative_config/trial_config.yaml;configs/strategies/ml_factor/autoresearch/v1_runs/ml_factor_classifier_v1/003_baseline_relative_config/trial_summary.md;configs/strategies/ml_factor/autoresearch/v1_runs/ml_factor_classifier_v1/003_baseline_relative_config/vectorbt_orders.csv;configs/strategies/ml_factor/autoresearch/v1_runs/ml_factor_classifier_v1/004_rank_score/command.json;configs/strategies/ml_factor/autoresearch/v1_runs/ml_factor_classifier_v1/004_rank_score/dataset_summary.csv;configs/strategies/ml_factor/autoresearch/v1_runs/ml_factor_classifier_v1/004_rank_score/effective_config.yaml;configs/strategies/ml_factor/autoresearch/v1_runs/ml_factor_classifier_v1/004_rank_score/manifest.json;configs/strategies/ml_factor/autoresearch/v1_runs/ml_factor_classifier_v1/004_rank_score/metrics.json;configs/strategies/ml_factor/autoresearch/v1_runs/ml_factor_classifier_v1/004_rank_score/model_frame.csv;configs/strategies/ml_factor/autoresearch/v1_runs/ml_factor_classifier_v1/004_rank_score/orders.csv;configs/strategies/ml_factor/autoresearch/v1_runs/ml_factor_classifier_v1/004_rank_score/orders_realized.csv;configs/strategies/ml_factor/autoresearch/v1_runs/ml_factor_classifier_v1/004_rank_score/orders_summary.csv;configs/strategies/ml_factor/autoresearch/v1_runs/ml_factor_classifier_v1/004_rank_score/params.csv;configs/strategies/ml_factor/autoresearch/v1_runs/ml_factor_classifier_v1/004_rank_score/portfolio.csv;configs/strategies/ml_factor/autoresearch/v1_runs/ml_factor_classifier_v1/004_rank_score/portfolio_stats.csv;configs/strategies/ml_factor/autoresearch/v1_runs/ml_factor_classifier_v1/004_rank_score/predictions.csv;configs/strategies/ml_factor/autoresearch/v1_runs/ml_factor_classifier_v1/004_rank_score/pyfolio_aligned_returns.csv;configs/strategies/ml_factor/autoresearch/v1_runs/ml_factor_classifier_v1/004_rank_score/pyfolio_stats.csv;configs/strategies/ml_factor/autoresearch/v1_runs/ml_factor_classifier_v1/004_rank_score/qts_metrics.csv;configs/strategies/ml_factor/autoresearch/v1_runs/ml_factor_classifier_v1/004_rank_score/run.log;configs/strategies/ml_factor/autoresearch/v1_runs/ml_factor_classifier_v1/004_rank_score/run_eval.csv;configs/strategies/ml_factor/autoresearch/v1_runs/ml_factor_classifier_v1/004_rank_score/selected_predictions.csv;configs/strategies/ml_factor/autoresearch/v1_runs/ml_factor_classifier_v1/004_rank_score/selected_realized_results.csv;configs/strategies/ml_factor/autoresearch/v1_runs/ml_factor_classifier_v1/004_rank_score/target_weights.csv;configs/strategies/ml_factor/autoresearch/v1_runs/ml_factor_classifier_v1/004_rank_score/trial_config.yaml;configs/strategies/ml_factor/autoresearch/v1_runs/ml_factor_classifier_v1/004_rank_score/trial_summary.md;configs/strategies/ml_factor/autoresearch/v1_runs/ml_factor_classifier_v1/004_rank_score/vectorbt_orders.csv;configs/strategies/ml_factor/autoresearch/v1_runs/ml_factor_classifier_v1/005_rank_score_max_positions_6/command.json;configs/strategies/ml_factor/autoresearch/v1_runs/ml_factor_classifier_v1/005_rank_score_max_positions_6/dataset_summary.csv;configs/strategies/ml_factor/autoresearch/v1_runs/ml_factor_classifier_v1/005_rank_score_max_positions_6/effective_config.yaml;configs/strategies/ml_factor/autoresearch/v1_runs/ml_factor_classifier_v1/005_rank_score_max_positions_6/manifest.json;configs/strategies/ml_factor/autoresearch/v1_runs/ml_factor_classifier_v1/005_rank_score_max_positions_6/metrics.json;configs/strategies/ml_factor/autoresearch/v1_runs/ml_factor_classifier_v1/005_rank_score_max_positions_6/model_frame.csv;configs/strategies/ml_factor/autoresearch/v1_runs/ml_factor_classifier_v1/005_rank_score_max_positions_6/orders.csv;configs/strategies/ml_factor/autoresearch/v1_runs/ml_factor_classifier_v1/005_rank_score_max_positions_6/orders_realized.csv;configs/strategies/ml_factor/autoresearch/v1_runs/ml_factor_classifier_v1/005_rank_score_max_positions_6/orders_summary.csv;configs/strategies/ml_factor/autoresearch/v1_runs/ml_factor_classifier_v1/005_rank_score_max_positions_6/params.csv;configs/strategies/ml_factor/autoresearch/v1_runs/ml_factor_classifier_v1/005_rank_score_max_positions_6/portfolio.csv;configs/strategies/ml_factor/autoresearch/v1_runs/ml_factor_classifier_v1/005_rank_score_max_positions_6/portfolio_stats.csv;configs/strategies/ml_factor/autoresearch/v1_runs/ml_factor_classifier_v1/005_rank_score_max_positions_6/predictions.csv;configs/strategies/ml_factor/autoresearch/v1_runs/ml_factor_classifier_v1/005_rank_score_max_positions_6/pyfolio_aligned_returns.csv;configs/strategies/ml_factor/autoresearch/v1_runs/ml_factor_classifier_v1/005_rank_score_max_positions_6/pyfolio_stats.csv;configs/strategies/ml_factor/autoresearch/v1_runs/ml_factor_classifier_v1/005_rank_score_max_positions_6/qts_metrics.csv;configs/strategies/ml_factor/autoresearch/v1_runs/ml_factor_classifier_v1/005_rank_score_max_positions_6/run.log;configs/strategies/ml_factor/autoresearch/v1_runs/ml_factor_classifier_v1/005_rank_score_max_positions_6/run_eval.csv;configs/strategies/ml_factor/autoresearch/v1_runs/ml_factor_classifier_v1/005_rank_score_max_positions_6/selected_predictions.csv;configs/strategies/ml_factor/autoresearch/v1_runs/ml_factor_classifier_v1/005_rank_score_max_positions_6/selected_realized_results.csv;configs/strategies/ml_factor/autoresearch/v1_runs/ml_factor_classifier_v1/005_rank_score_max_positions_6/target_weights.csv;configs/strategies/ml_factor/autoresearch/v1_runs/ml_factor_classifier_v1/005_rank_score_max_positions_6/trial_config.yaml;configs/strategies/ml_factor/autoresearch/v1_runs/ml_factor_classifier_v1/005_rank_score_max_positions_6/trial_summary.md;configs/strategies/ml_factor/autoresearch/v1_runs/ml_factor_classifier_v1/005_rank_score_max_positions_6/vectorbt_orders.csv	configs/strategies/ml_factor/autoresearch/v1_runs/ml_factor_classifier_v1/005_rank_score_max_positions_6	rank_col=score max_positions=6
