trial	run_id	commit	status	stop_reason	objective_metric	objective_value	best_value	criteria_hit	hit_metric	sharpe	sortino	cagr	max_drawdown	win_rate	signal_rows	featured_rows	predictor_count	wall_seconds	idea_family	changed_files	artifact_dir	description
8	008_rank_score_rebalance_5	5d41830	discard	continue	sharpe	1.135804104523059	1.4502032808497105	false		1.135804104523059	1.1009153199090056	0.1895430600142285	0.2877184440175244	0.32633587786259544				14.917443762067705	tune_hyperparams	configs/strategies/ml_factor/autoresearch/v1_ledger/next_steps.md;configs/strategies/ml_factor/autoresearch/v1_runs/ml_factor_classifier_v1/003_baseline_relative_config/command.json;configs/strategies/ml_factor/autoresearch/v1_runs/ml_factor_classifier_v1/003_baseline_relative_config/dataset_summary.csv;configs/strategies/ml_factor/autoresearch/v1_runs/ml_factor_classifier_v1/003_baseline_relative_config/effective_config.yaml;configs/strategies/ml_factor/autoresearch/v1_runs/ml_factor_classifier_v1/003_baseline_relative_config/manifest.json;configs/strategies/ml_factor/autoresearch/v1_runs/ml_factor_classifier_v1/003_baseline_relative_config/metrics.json;configs/strategies/ml_factor/autoresearch/v1_runs/ml_factor_classifier_v1/003_baseline_relative_config/model_frame.csv;configs/strategies/ml_factor/autoresearch/v1_runs/ml_factor_classifier_v1/003_baseline_relative_config/orders.csv;configs/strategies/ml_factor/autoresearch/v1_runs/ml_factor_classifier_v1/003_baseline_relative_config/orders_realized.csv;configs/strategies/ml_factor/autoresearch/v1_runs/ml_factor_classifier_v1/003_baseline_relative_config/orders_summary.csv;configs/strategies/ml_factor/autoresearch/v1_runs/ml_factor_classifier_v1/003_baseline_relative_config/params.csv;configs/strategies/ml_factor/autoresearch/v1_runs/ml_factor_classifier_v1/003_baseline_relative_config/portfolio.csv;configs/strategies/ml_factor/autoresearch/v1_runs/ml_factor_classifier_v1/003_baseline_relative_config/portfolio_stats.csv;configs/strategies/ml_factor/autoresearch/v1_runs/ml_factor_classifier_v1/003_baseline_relative_config/predictions.csv;configs/strategies/ml_factor/autoresearch/v1_runs/ml_factor_classifier_v1/003_baseline_relative_config/pyfolio_aligned_returns.csv;configs/strategies/ml_factor/autoresearch/v1_runs/ml_factor_classifier_v1/003_baseline_relative_config/pyfolio_stats.csv;configs/strategies/ml_factor/autoresearch/v1_runs/ml_factor_classifier_v1/003_baseline_relative_config/qts_metrics.csv;configs/strategies/ml_factor/autoresearch/v1_runs/ml_factor_classifier_v1/003_baseline_relative_config/run.log;configs/strategies/ml_factor/autoresearch/v1_runs/ml_factor_classifier_v1/003_baseline_relative_config/run_eval.csv;configs/strategies/ml_factor/autoresearch/v1_runs/ml_factor_classifier_v1/003_baseline_relative_config/selected_predictions.csv;configs/strategies/ml_factor/autoresearch/v1_runs/ml_factor_classifier_v1/003_baseline_relative_config/selected_realized_results.csv;configs/strategies/ml_factor/autoresearch/v1_runs/ml_factor_classifier_v1/003_baseline_relative_config/target_weights.csv;configs/strategies/ml_factor/autoresearch/v1_runs/ml_factor_classifier_v1/003_baseline_relative_config/trial_config.yaml;configs/strategies/ml_factor/autoresearch/v1_runs/ml_factor_classifier_v1/003_baseline_relative_config/trial_summary.md;configs/strategies/ml_factor/autoresearch/v1_runs/ml_factor_classifier_v1/003_baseline_relative_config/vectorbt_orders.csv;configs/strategies/ml_factor/autoresearch/v1_runs/ml_factor_classifier_v1/004_rank_score/command.json;configs/strategies/ml_factor/autoresearch/v1_runs/ml_factor_classifier_v1/004_rank_score/dataset_summary.csv;configs/strategies/ml_factor/autoresearch/v1_runs/ml_factor_classifier_v1/004_rank_score/effective_config.yaml;configs/strategies/ml_factor/autoresearch/v1_runs/ml_factor_classifier_v1/004_rank_score/manifest.json;configs/strategies/ml_factor/autoresearch/v1_runs/ml_factor_classifier_v1/004_rank_score/metrics.json;configs/strategies/ml_factor/autoresearch/v1_runs/ml_factor_classifier_v1/004_rank_score/model_frame.csv;configs/strategies/ml_factor/autoresearch/v1_runs/ml_factor_classifier_v1/004_rank_score/orders.csv;configs/strategies/ml_factor/autoresearch/v1_runs/ml_factor_classifier_v1/004_rank_score/orders_realized.csv;configs/strategies/ml_factor/autoresearch/v1_runs/ml_factor_classifier_v1/004_rank_score/orders_summary.csv;configs/strategies/ml_factor/autoresearch/v1_runs/ml_factor_classifier_v1/004_rank_score/params.csv;configs/strategies/ml_factor/autoresearch/v1_runs/ml_factor_classifier_v1/004_rank_score/portfolio.csv;configs/strategies/ml_factor/autoresearch/v1_runs/ml_factor_classifier_v1/004_rank_score/portfolio_stats.csv;configs/strategies/ml_factor/autoresearch/v1_runs/ml_factor_classifier_v1/004_rank_score/predictions.csv;configs/strategies/ml_factor/autoresearch/v1_runs/ml_factor_classifier_v1/004_rank_score/pyfolio_aligned_returns.csv;configs/strategies/ml_factor/autoresearch/v1_runs/ml_factor_classifier_v1/004_rank_score/pyfolio_stats.csv;configs/strategies/ml_factor/autoresearch/v1_runs/ml_factor_classifier_v1/004_rank_score/qts_metrics.csv;configs/strategies/ml_factor/autoresearch/v1_runs/ml_factor_classifier_v1/004_rank_score/run.log;configs/strategies/ml_factor/autoresearch/v1_runs/ml_factor_classifier_v1/004_rank_score/run_eval.csv;configs/strategies/ml_factor/autoresearch/v1_runs/ml_factor_classifier_v1/004_rank_score/selected_predictions.csv;configs/strategies/ml_factor/autoresearch/v1_runs/ml_factor_classifier_v1/004_rank_score/selected_realized_results.csv;configs/strategies/ml_factor/autoresearch/v1_runs/ml_factor_classifier_v1/004_rank_score/target_weights.csv;configs/strategies/ml_factor/autoresearch/v1_runs/ml_factor_classifier_v1/004_rank_score/trial_config.yaml;configs/strategies/ml_factor/autoresearch/v1_runs/ml_factor_classifier_v1/004_rank_score/trial_summary.md;configs/strategies/ml_factor/autoresearch/v1_runs/ml_factor_classifier_v1/004_rank_score/vectorbt_orders.csv;configs/strategies/ml_factor/autoresearch/v1_runs/ml_factor_classifier_v1/005_rank_score_max_positions_6/command.json;configs/strategies/ml_factor/autoresearch/v1_runs/ml_factor_classifier_v1/005_rank_score_max_positions_6/dataset_summary.csv;configs/strategies/ml_factor/autoresearch/v1_runs/ml_factor_classifier_v1/005_rank_score_max_positions_6/effective_config.yaml;configs/strategies/ml_factor/autoresearch/v1_runs/ml_factor_classifier_v1/005_rank_score_max_positions_6/manifest.json;configs/strategies/ml_factor/autoresearch/v1_runs/ml_factor_classifier_v1/005_rank_score_max_positions_6/metrics.json;configs/strategies/ml_factor/autoresearch/v1_runs/ml_factor_classifier_v1/005_rank_score_max_positions_6/model_frame.csv;configs/strategies/ml_factor/autoresearch/v1_runs/ml_factor_classifier_v1/005_rank_score_max_positions_6/orders.csv;configs/strategies/ml_factor/autoresearch/v1_runs/ml_factor_classifier_v1/005_rank_score_max_positions_6/orders_realized.csv;configs/strategies/ml_factor/autoresearch/v1_runs/ml_factor_classifier_v1/005_rank_score_max_positions_6/orders_summary.csv;configs/strategies/ml_factor/autoresearch/v1_runs/ml_factor_classifier_v1/005_rank_score_max_positions_6/params.csv;configs/strategies/ml_factor/autoresearch/v1_runs/ml_factor_classifier_v1/005_rank_score_max_positions_6/portfolio.csv;configs/strategies/ml_factor/autoresearch/v1_runs/ml_factor_classifier_v1/005_rank_score_max_positions_6/portfolio_stats.csv;configs/strategies/ml_factor/autoresearch/v1_runs/ml_factor_classifier_v1/005_rank_score_max_positions_6/predictions.csv;configs/strategies/ml_factor/autoresearch/v1_runs/ml_factor_classifier_v1/005_rank_score_max_positions_6/pyfolio_aligned_returns.csv;configs/strategies/ml_factor/autoresearch/v1_runs/ml_factor_classifier_v1/005_rank_score_max_positions_6/pyfolio_stats.csv;configs/strategies/ml_factor/autoresearch/v1_runs/ml_factor_classifier_v1/005_rank_score_max_positions_6/qts_metrics.csv;configs/strategies/ml_factor/autoresearch/v1_runs/ml_factor_classifier_v1/005_rank_score_max_positions_6/run.log;configs/strategies/ml_factor/autoresearch/v1_runs/ml_factor_classifier_v1/005_rank_score_max_positions_6/run_eval.csv;configs/strategies/ml_factor/autoresearch/v1_runs/ml_factor_classifier_v1/005_rank_score_max_positions_6/selected_predictions.csv;configs/strategies/ml_factor/autoresearch/v1_runs/ml_factor_classifier_v1/005_rank_score_max_positions_6/selected_realized_results.csv;configs/strategies/ml_factor/autoresearch/v1_runs/ml_factor_classifier_v1/005_rank_score_max_positions_6/target_weights.csv;configs/strategies/ml_factor/autoresearch/v1_runs/ml_factor_classifier_v1/005_rank_score_max_positions_6/trial_config.yaml;configs/strategies/ml_factor/autoresearch/v1_runs/ml_factor_classifier_v1/005_rank_score_max_positions_6/trial_summary.md;configs/strategies/ml_factor/autoresearch/v1_runs/ml_factor_classifier_v1/005_rank_score_max_positions_6/vectorbt_orders.csv;configs/strategies/ml_factor/autoresearch/v1_runs/ml_factor_classifier_v1/006_rank_score_max_positions_3/command.json;configs/strategies/ml_factor/autoresearch/v1_runs/ml_factor_classifier_v1/006_rank_score_max_positions_3/dataset_summary.csv;configs/strategies/ml_factor/autoresearch/v1_runs/ml_factor_classifier_v1/006_rank_score_max_positions_3/effective_config.yaml;configs/strategies/ml_factor/autoresearch/v1_runs/ml_factor_classifier_v1/006_rank_score_max_positions_3/manifest.json;configs/strategies/ml_factor/autoresearch/v1_runs/ml_factor_classifier_v1/006_rank_score_max_positions_3/metrics.json;configs/strategies/ml_factor/autoresearch/v1_runs/ml_factor_classifier_v1/006_rank_score_max_positions_3/model_frame.csv;configs/strategies/ml_factor/autoresearch/v1_runs/ml_factor_classifier_v1/006_rank_score_max_positions_3/orders.csv;configs/strategies/ml_factor/autoresearch/v1_runs/ml_factor_classifier_v1/006_rank_score_max_positions_3/orders_realized.csv;configs/strategies/ml_factor/autoresearch/v1_runs/ml_factor_classifier_v1/006_rank_score_max_positions_3/orders_summary.csv;configs/strategies/ml_factor/autoresearch/v1_runs/ml_factor_classifier_v1/006_rank_score_max_positions_3/params.csv;configs/strategies/ml_factor/autoresearch/v1_runs/ml_factor_classifier_v1/006_rank_score_max_positions_3/portfolio.csv;configs/strategies/ml_factor/autoresearch/v1_runs/ml_factor_classifier_v1/006_rank_score_max_positions_3/portfolio_stats.csv;configs/strategies/ml_factor/autoresearch/v1_runs/ml_factor_classifier_v1/006_rank_score_max_positions_3/predictions.csv;configs/strategies/ml_factor/autoresearch/v1_runs/ml_factor_classifier_v1/006_rank_score_max_positions_3/pyfolio_aligned_returns.csv;configs/strategies/ml_factor/autoresearch/v1_runs/ml_factor_classifier_v1/006_rank_score_max_positions_3/pyfolio_stats.csv;configs/strategies/ml_factor/autoresearch/v1_runs/ml_factor_classifier_v1/006_rank_score_max_positions_3/qts_metrics.csv;configs/strategies/ml_factor/autoresearch/v1_runs/ml_factor_classifier_v1/006_rank_score_max_positions_3/run.log;configs/strategies/ml_factor/autoresearch/v1_runs/ml_factor_classifier_v1/006_rank_score_max_positions_3/run_eval.csv;configs/strategies/ml_factor/autoresearch/v1_runs/ml_factor_classifier_v1/006_rank_score_max_positions_3/selected_predictions.csv;configs/strategies/ml_factor/autoresearch/v1_runs/ml_factor_classifier_v1/006_rank_score_max_positions_3/selected_realized_results.csv;configs/strategies/ml_factor/autoresearch/v1_runs/ml_factor_classifier_v1/006_rank_score_max_positions_3/target_weights.csv;configs/strategies/ml_factor/autoresearch/v1_runs/ml_factor_classifier_v1/006_rank_score_max_positions_3/trial_config.yaml;configs/strategies/ml_factor/autoresearch/v1_runs/ml_factor_classifier_v1/006_rank_score_max_positions_3/trial_summary.md;configs/strategies/ml_factor/autoresearch/v1_runs/ml_factor_classifier_v1/006_rank_score_max_positions_3/vectorbt_orders.csv;configs/strategies/ml_factor/autoresearch/v1_runs/ml_factor_classifier_v1/007_rank_score_max_positions_4/command.json;configs/strategies/ml_factor/autoresearch/v1_runs/ml_factor_classifier_v1/007_rank_score_max_positions_4/dataset_summary.csv;configs/strategies/ml_factor/autoresearch/v1_runs/ml_factor_classifier_v1/007_rank_score_max_positions_4/effective_config.yaml;configs/strategies/ml_factor/autoresearch/v1_runs/ml_factor_classifier_v1/007_rank_score_max_positions_4/manifest.json;configs/strategies/ml_factor/autoresearch/v1_runs/ml_factor_classifier_v1/007_rank_score_max_positions_4/metrics.json;configs/strategies/ml_factor/autoresearch/v1_runs/ml_factor_classifier_v1/007_rank_score_max_positions_4/model_frame.csv;configs/strategies/ml_factor/autoresearch/v1_runs/ml_factor_classifier_v1/007_rank_score_max_positions_4/orders.csv;configs/strategies/ml_factor/autoresearch/v1_runs/ml_factor_classifier_v1/007_rank_score_max_positions_4/orders_realized.csv;configs/strategies/ml_factor/autoresearch/v1_runs/ml_factor_classifier_v1/007_rank_score_max_positions_4/orders_summary.csv;configs/strategies/ml_factor/autoresearch/v1_runs/ml_factor_classifier_v1/007_rank_score_max_positions_4/params.csv;configs/strategies/ml_factor/autoresearch/v1_runs/ml_factor_classifier_v1/007_rank_score_max_positions_4/portfolio.csv;configs/strategies/ml_factor/autoresearch/v1_runs/ml_factor_classifier_v1/007_rank_score_max_positions_4/portfolio_stats.csv;configs/strategies/ml_factor/autoresearch/v1_runs/ml_factor_classifier_v1/007_rank_score_max_positions_4/predictions.csv;configs/strategies/ml_factor/autoresearch/v1_runs/ml_factor_classifier_v1/007_rank_score_max_positions_4/pyfolio_aligned_returns.csv;configs/strategies/ml_factor/autoresearch/v1_runs/ml_factor_classifier_v1/007_rank_score_max_positions_4/pyfolio_stats.csv;configs/strategies/ml_factor/autoresearch/v1_runs/ml_factor_classifier_v1/007_rank_score_max_positions_4/qts_metrics.csv;configs/strategies/ml_factor/autoresearch/v1_runs/ml_factor_classifier_v1/007_rank_score_max_positions_4/run.log;configs/strategies/ml_factor/autoresearch/v1_runs/ml_factor_classifier_v1/007_rank_score_max_positions_4/run_eval.csv;configs/strategies/ml_factor/autoresearch/v1_runs/ml_factor_classifier_v1/007_rank_score_max_positions_4/selected_predictions.csv;configs/strategies/ml_factor/autoresearch/v1_runs/ml_factor_classifier_v1/007_rank_score_max_positions_4/selected_realized_results.csv;configs/strategies/ml_factor/autoresearch/v1_runs/ml_factor_classifier_v1/007_rank_score_max_positions_4/target_weights.csv;configs/strategies/ml_factor/autoresearch/v1_runs/ml_factor_classifier_v1/007_rank_score_max_positions_4/trial_config.yaml;configs/strategies/ml_factor/autoresearch/v1_runs/ml_factor_classifier_v1/007_rank_score_max_positions_4/trial_summary.md;configs/strategies/ml_factor/autoresearch/v1_runs/ml_factor_classifier_v1/007_rank_score_max_positions_4/vectorbt_orders.csv;configs/strategies/ml_factor/autoresearch/v1_runs/ml_factor_classifier_v1/008_rank_score_rebalance_5/command.json;configs/strategies/ml_factor/autoresearch/v1_runs/ml_factor_classifier_v1/008_rank_score_rebalance_5/dataset_summary.csv;configs/strategies/ml_factor/autoresearch/v1_runs/ml_factor_classifier_v1/008_rank_score_rebalance_5/effective_config.yaml;configs/strategies/ml_factor/autoresearch/v1_runs/ml_factor_classifier_v1/008_rank_score_rebalance_5/manifest.json;configs/strategies/ml_factor/autoresearch/v1_runs/ml_factor_classifier_v1/008_rank_score_rebalance_5/metrics.json;configs/strategies/ml_factor/autoresearch/v1_runs/ml_factor_classifier_v1/008_rank_score_rebalance_5/model_frame.csv;configs/strategies/ml_factor/autoresearch/v1_runs/ml_factor_classifier_v1/008_rank_score_rebalance_5/orders.csv;configs/strategies/ml_factor/autoresearch/v1_runs/ml_factor_classifier_v1/008_rank_score_rebalance_5/orders_realized.csv;configs/strategies/ml_factor/autoresearch/v1_runs/ml_factor_classifier_v1/008_rank_score_rebalance_5/orders_summary.csv;configs/strategies/ml_factor/autoresearch/v1_runs/ml_factor_classifier_v1/008_rank_score_rebalance_5/params.csv;configs/strategies/ml_factor/autoresearch/v1_runs/ml_factor_classifier_v1/008_rank_score_rebalance_5/portfolio.csv;configs/strategies/ml_factor/autoresearch/v1_runs/ml_factor_classifier_v1/008_rank_score_rebalance_5/portfolio_stats.csv;configs/strategies/ml_factor/autoresearch/v1_runs/ml_factor_classifier_v1/008_rank_score_rebalance_5/predictions.csv;configs/strategies/ml_factor/autoresearch/v1_runs/ml_factor_classifier_v1/008_rank_score_rebalance_5/pyfolio_aligned_returns.csv;configs/strategies/ml_factor/autoresearch/v1_runs/ml_factor_classifier_v1/008_rank_score_rebalance_5/pyfolio_stats.csv;configs/strategies/ml_factor/autoresearch/v1_runs/ml_factor_classifier_v1/008_rank_score_rebalance_5/qts_metrics.csv;configs/strategies/ml_factor/autoresearch/v1_runs/ml_factor_classifier_v1/008_rank_score_rebalance_5/run.log;configs/strategies/ml_factor/autoresearch/v1_runs/ml_factor_classifier_v1/008_rank_score_rebalance_5/run_eval.csv;configs/strategies/ml_factor/autoresearch/v1_runs/ml_factor_classifier_v1/008_rank_score_rebalance_5/selected_predictions.csv;configs/strategies/ml_factor/autoresearch/v1_runs/ml_factor_classifier_v1/008_rank_score_rebalance_5/selected_realized_results.csv;configs/strategies/ml_factor/autoresearch/v1_runs/ml_factor_classifier_v1/008_rank_score_rebalance_5/target_weights.csv;configs/strategies/ml_factor/autoresearch/v1_runs/ml_factor_classifier_v1/008_rank_score_rebalance_5/trial_config.yaml;configs/strategies/ml_factor/autoresearch/v1_runs/ml_factor_classifier_v1/008_rank_score_rebalance_5/trial_summary.md;configs/strategies/ml_factor/autoresearch/v1_runs/ml_factor_classifier_v1/008_rank_score_rebalance_5/vectorbt_orders.csv	configs/strategies/ml_factor/autoresearch/v1_runs/ml_factor_classifier_v1/008_rank_score_rebalance_5	rank_col=score rebalance_frequency=5
9	009_rank_score_rebalance_10	5d41830	discard	continue	sharpe	1.168350728974892	1.4502032808497105	false		1.168350728974892	1.1263921238184456	0.19856627234520685	0.3505471490179958	0.3344465648854962				11.914058190770447	tune_hyperparams	[compacted 169 paths; full backup: results.pre_compact_20260629_ledger_fieldlimit.tsv]	configs/strategies/ml_factor/autoresearch/v1_runs/ml_factor_classifier_v1/009_rank_score_rebalance_10	rank_col=score rebalance_frequency=10
10	010_rank_score_forward_10	5d41830	discard	continue	sharpe	0.9568715066318714	1.4502032808497105	false		0.9568715066318714	0.9188752313060643	0.1892133995468337	0.45056397177103763	0.3520992366412214				10.00618374813348	tune_hyperparams	[compacted 193 paths; full backup: results.pre_compact_20260629_ledger_fieldlimit.tsv]	configs/strategies/ml_factor/autoresearch/v1_runs/ml_factor_classifier_v1/010_rank_score_forward_10	rank_col=score forward_period=10
11	011_rank_score_xgb_20_depth3	5d41830	discard	continue	sharpe	1.367854103831719	1.4502032808497105	false		1.367854103831719	1.4458143771855476	0.350116222278793	0.37627516765528946	0.36450381679389315				28.03200631402433	tune_hyperparams	[compacted 217 paths; full backup: results.pre_compact_20260629_ledger_fieldlimit.tsv]	configs/strategies/ml_factor/autoresearch/v1_runs/ml_factor_classifier_v1/011_rank_score_xgb_20_depth3	rank_col=score xgb_n_estimators=20 xgb_max_depth=3
12	012_rank_score_xgb_50_depth2	5d41830	discard	continue	sharpe	1.0068580821715911	1.4502032808497105	false		1.0068580821715911	1.0450436610562905	0.23793098717171146	0.45122125144473185	0.35639312977099236				49.89219469297677	tune_hyperparams	[compacted 241 paths; full backup: results.pre_compact_20260629_ledger_fieldlimit.tsv]	configs/strategies/ml_factor/autoresearch/v1_runs/ml_factor_classifier_v1/012_rank_score_xgb_50_depth2	rank_col=score xgb_n_estimators=50 xgb_max_depth=2
13	013_rank_score_xgb_lr_005	5d41830	discard	continue	sharpe	0.33867873503709744	1.4502032808497105	false		0.33867873503709744	0.3165539309018852	0.030620351670392454	0.29946703840670064	0.22948473282442747				13.263686802238226	tune_hyperparams	[compacted 265 paths; full backup: results.pre_compact_20260629_ledger_fieldlimit.tsv]	configs/strategies/ml_factor/autoresearch/v1_runs/ml_factor_classifier_v1/013_rank_score_xgb_lr_005	rank_col=score xgb_learning_rate=0.05
14	014_rank_score_quantiles_tail	5d41830	discard	continue	sharpe	-0.17335257283916836	1.4502032808497105	false		-0.17335257283916836	-0.1442265429233813	-0.03173821988498671	0.5508893933488674	0.23091603053435114				12.317308200988919	tune_hyperparams	[compacted 289 paths; full backup: results.pre_compact_20260629_ledger_fieldlimit.tsv]	configs/strategies/ml_factor/autoresearch/v1_runs/ml_factor_classifier_v1/014_rank_score_quantiles_tail	rank_col=score class_quantiles=0.10,0.35,0.65,0.90
15	015_rank_score_threshold_025	5d41830	discard	continue	sharpe	1.3079008439106647	1.4502032808497105	false		1.3079008439106647	1.401869484928288	0.3278063644647189	0.2843357641246119	0.36211832061068705				13.363949018996209	tune_hyperparams	[compacted 313 paths; full backup: results.pre_compact_20260629_ledger_fieldlimit.tsv]	configs/strategies/ml_factor/autoresearch/v1_runs/ml_factor_classifier_v1/015_rank_score_threshold_025	rank_col=score probability_threshold=0.25
16	016_rank_score_threshold_035	5d41830	discard	continue	sharpe	-0.036995933724511335	1.4502032808497105	false		-0.036995933724511335	-0.03138600646967153	-0.01128245291488239	0.4297962263758304	0.22709923664122136				17.38577971002087	tune_hyperparams	[compacted 337 paths; full backup: results.pre_compact_20260629_ledger_fieldlimit.tsv]	configs/strategies/ml_factor/autoresearch/v1_runs/ml_factor_classifier_v1/016_rank_score_threshold_035	rank_col=score probability_threshold=0.35
